Unnamed: 0,author_id,verified_purchase,review_title,reviews,date,reviewer_name,ratings,people_find_helpful,reviewer_profile_url,start_time,end_time,product_name,average_rating,total_reviews,product_category,product_id,brand_name,rank
117,AG66UQEC35JPZS4Q7DIQWZ7G7PNQ,True,Thumbs up,It's great funny shirt,"May 9, 2020",Tammy Guilbeault,5.0,0,https://www.amazon.ca/gp/profile/amzn1.account.AG66UQEC35JPZS4Q7DIQWZ7G7PNQ/ref=cm_cr_getr_d_gw_btm?ie=UTF8,2020-09-28 19:58:29.417073,2020-09-28 19:58:29.535168,Hanes Mens Graphic Tee - Humor T-Shirt,4.6,,Clothing & Accessories,B01EKB6BMU,Hanes Men's Athletic Child Code,293
118,AE32V47CNVJXKK2CEYNT36HCOYAA,True,Was as expected,Great fit and shipped fast thanks,"June 1, 2020",Candace Marie Lytle,5.0,0,https://www.amazon.ca/gp/profile/amzn1.account.AE32V47CNVJXKK2CEYNT36HCOYAA/ref=cm_cr_getr_d_gw_btm?ie=UTF8,2020-09-28 19:58:29.539073,2020-09-28 19:58:29.678640,Hanes Mens Graphic Tee - Humor T-Shirt,4.6,,Clothing & Accessories,B01EKB6BMU,Hanes Men's Athletic Child Code,293
119,AHP7PT3KULRHOYS7Q4GNNCOFVALA,True,Conforme,très bien,"November 19, 2019",Guy R.,5.0,0,https://www.amazon.ca/gp/profile/amzn1.account.AHP7PT3KULRHOYS7Q4GNNCOFVALA/ref=cm_cr_getr_d_gw_btm?ie=UTF8,2020-09-28 19:58:29.683520,2020-09-28 19:58:29.806496,Hanes Mens Graphic Tee - Humor T-Shirt,4.6,,Clothing & Accessories,B01EKB6BMU,Hanes Men's Athletic Child Code,293
120,AGEKI7JIWKFQXTFGGSIZAPM2Q2EA,True,Nithing,Good,"July 1, 2020",Jesse,3.0,0,https://www.amazon.ca/gp/profile/amzn1.account.AGEKI7JIWKFQXTFGGSIZAPM2Q2EA/ref=cm_cr_getr_d_gw_btm?ie=UTF8,2020-09-28 19:58:34.948530,2020-09-28 19:58:35.112496,Hanes Mens Graphic Tee - Humor T-Shirt,4.6,,Clothing & Accessories,B01EKB6BMU,Hanes Men's Athletic Child Code,293
121,AETIIZFNWR2CLRDCYQ4KE6XGDVIA,True,Good choice,Perfect gift for my son-in-law . He loved it.,"December 18, 2018",mom (in-law) ,4.0,0,https://www.amazon.ca/gp/profile/amzn1.account.AETIIZFNWR2CLRDCYQ4KE6XGDVIA/ref=cm_cr_getr_d_gw_btm?ie=UTF8,2020-09-28 19:58:35.117376,2020-09-28 19:58:35.242332,Hanes Mens Graphic Tee - Humor T-Shirt,4.6,,Clothing & Accessories,B01EKB6BMU,Hanes Men's Athletic Child Code,293
122,AEXB7SOGXZE7I5YNCXKLB3JHYSQQ,True,Fits great,"Thin material, but comfortable and cool!","July 20, 2018",Bryan,5.0,0,https://www.amazon.ca/gp/profile/amzn1.account.AEXB7SOGXZE7I5YNCXKLB3JHYSQQ/ref=cm_cr_getr_d_gw_btm?ie=UTF8,2020-09-28 19:58:35.246208,2020-09-28 19:58:35.370159,Hanes Mens Graphic Tee - Humor T-Shirt,4.6,,Clothing & Accessories,B01EKB6BMU,Hanes Men's Athletic Child Code,293
123,AHIBRJK2RBFZW5GCCHR366HF6C6Q,True,Five Stars,As advertised,"December 18, 2017",Sandra Carlson,5.0,0,https://www.amazon.ca/gp/profile/amzn1.account.AHIBRJK2RBFZW5GCCHR366HF6C6Q/ref=cm_cr_getr_d_gw_btm?ie=UTF8,2020-09-28 19:58:35.374063,2020-09-28 19:58:35.519487,Hanes Mens Graphic Tee - Humor T-Shirt,4.6,,Clothing & Accessories,B01EKB6BMU,Hanes Men's Athletic Child Code,293
124,AEKX5QKK4YISO55G6GYI2EVJKRRQ,True,It arrived on time and it came in good conditions. My dad loved it,It looks just as in the picture. It arrived on time and it came in good conditions. My dad loved it.,"January 3, 2018",Kelly,5.0,0,https://www.amazon.ca/gp/profile/amzn1.account.AEKX5QKK4YISO55G6GYI2EVJKRRQ/ref=cm_cr_getr_d_gw_btm?ie=UTF8,2020-09-28 19:58:35.524368,2020-09-28 19:58:35.650271,Hanes Mens Graphic Tee - Humor T-Shirt,4.6,,Clothing & Accessories,B01EKB6BMU,Hanes Men's Athletic Child Code,293
125,AEDOANTB5TH5VGRFIIMSHBT4XKLA,True,Five Stars,Good size,"September 8, 2018",Client d'Amazon,5.0,0,https://www.amazon.ca/gp/profile/amzn1.account.AEDOANTB5TH5VGRFIIMSHBT4XKLA/ref=cm_cr_getr_d_gw_btm?ie=UTF8,2020-09-28 19:58:35.654174,2020-09-28 19:58:35.783006,Hanes Mens Graphic Tee - Humor T-Shirt,4.6,,Clothing & Accessories,B01EKB6BMU,Hanes Men's Athletic Child Code,293
126,AF72AY45HG4DMJ2EN56H3CWPBOXA,True,Great tshirt,Nice!,"November 2, 2019",KJ,5.0,0,https://www.amazon.ca/gp/profile/amzn1.account.AF72AY45HG4DMJ2EN56H3CWPBOXA/ref=cm_cr_getr_d_gw_btm?ie=UTF8,2020-09-28 19:58:35.786911,2020-09-28 19:58:35.931358,Hanes Mens Graphic Tee - Humor T-Shirt,4.6,,Clothing & Accessories,B01EKB6BMU,Hanes Men's Athletic Child Code,293
127,AHGI25CZBVIQDWTRXH2SRETHCIAQ,True,Awesome.,Bought it for my husband. he loves it. Great fit.,"March 28, 2018",Catherine Hubbard,5.0,0,https://www.amazon.ca/gp/profile/amzn1.account.AHGI25CZBVIQDWTRXH2SRETHCIAQ/ref=cm_cr_getr_d_gw_btm?ie=UTF8,2020-09-28 19:58:35.936238,2020-09-28 19:58:36.060189,Hanes Mens Graphic Tee - Humor T-Shirt,4.6,,Clothing & Accessories,B01EKB6BMU,Hanes Men's Athletic Child Code,293
128,AHB67ZUXW2YXDJVFA5Y2XTBM3ZRA,True,T shirt,Hubby loves his new T shirt.,"June 2, 2019",Jude,5.0,0,https://www.amazon.ca/gp/profile/amzn1.account.AHB67ZUXW2YXDJVFA5Y2XTBM3ZRA/ref=cm_cr_getr_d_gw_btm?ie=UTF8,2020-09-28 19:58:36.064094,2020-09-28 19:58:36.181214,Hanes Mens Graphic Tee - Humor T-Shirt,4.6,,Clothing & Accessories,B01EKB6BMU,Hanes Men's Athletic Child Code,293
129,AEMH2BIUBQNOVXBF4C3MBKOVGUOQ,True,Comfy,"My mom likes it, wears it to every family gathering","August 14, 2019",Sanghera,5.0,0,https://www.amazon.ca/gp/profile/amzn1.account.AEMH2BIUBQNOVXBF4C3MBKOVGUOQ/ref=cm_cr_getr_d_gw_btm?ie=UTF8,2020-09-28 19:58:36.185118,2020-09-28 19:58:36.332494,Hanes Mens Graphic Tee - Humor T-Shirt,4.6,,Clothing & Accessories,B01EKB6BMU,Hanes Men's Athletic Child Code,293
130,AFLPAVZJB2VK25ATQC6OOIXNH76A,True,Perfect size great quality,Good quality Hanes cotton shirt,"November 7, 2018",Amazon Customer,5.0,0,https://www.amazon.ca/gp/profile/amzn1.account.AFLPAVZJB2VK25ATQC6OOIXNH76A/ref=cm_cr_getr_d_gw_btm?ie=UTF8,2020-09-28 19:58:42.507060,2020-09-28 19:58:42.667122,Hanes Mens Graphic Tee - Humor T-Shirt,4.6,,Clothing & Accessories,B01EKB6BMU,Hanes Men's Athletic Child Code,293
131,AFAL4SCHZEK5RLB2TTYZXAI7Y5RQ,True,Très bien,"Propre, bien emballé et grandeur ok 👌","August 24, 2020",Annie ,5.0,0,https://www.amazon.ca/gp/profile/amzn1.account.AFAL4SCHZEK5RLB2TTYZXAI7Y5RQ/ref=cm_cr_getr_d_gw_btm?ie=UTF8,2020-09-28 19:58:42.671025,2020-09-28 19:58:42.797907,Hanes Mens Graphic Tee - Humor T-Shirt,4.6,,Clothing & Accessories,B01EKB6BMU,Hanes Men's Athletic Child Code,293
132,AFSRTGD6INE3O7HNLVEAUCI6324A,True,Feels and looks cheap,Feels and looks cheap,"November 1, 2019",me,1.0,0,https://www.amazon.ca/gp/profile/amzn1.account.AFSRTGD6INE3O7HNLVEAUCI6324A/ref=cm_cr_getr_d_gw_btm?ie=UTF8,2020-09-28 19:58:42.801810,2020-09-28 19:58:42.916978,Hanes Mens Graphic Tee - Humor T-Shirt,4.6,,Clothing & Accessories,B01EKB6BMU,Hanes Men's Athletic Child Code,293
133,AGGSEVEUOJUF7SDPHEY6UVRMIJNQ,True,Awesome,Good quality. Will buy again,"July 6, 2020",Mohsen,5.0,0,https://www.amazon.ca/gp/profile/amzn1.account.AGGSEVEUOJUF7SDPHEY6UVRMIJNQ/ref=cm_cr_getr_d_gw_btm?ie=UTF8,2020-09-28 19:58:42.920883,2020-09-28 19:58:43.060449,Hanes Mens Graphic Tee - Humor T-Shirt,4.6,,Clothing & Accessories,B01EKB6BMU,Hanes Men's Athletic Child Code,293
134,AFA5JXQJBGZRJULYGIHF5PICRMGA,True,"Was Fast, and just what i wanted!!!",Awesome! And arrived soon than expected!!!,"November 29, 2019",jessy,5.0,0,https://www.amazon.ca/gp/profile/amzn1.account.AFA5JXQJBGZRJULYGIHF5PICRMGA/ref=cm_cr_getr_d_gw_btm?ie=UTF8,2020-09-28 19:58:43.064353,2020-09-28 19:58:43.182450,Hanes Mens Graphic Tee - Humor T-Shirt,4.6,,Clothing & Accessories,B01EKB6BMU,Hanes Men's Athletic Child Code,293
135,AHOLJ3V5GFH6K5RFNQGJINFSJZWQ,True,As expected,"Nice quality, as expected","February 21, 2019",Mary Jo Gehri,5.0,0,https://www.amazon.ca/gp/profile/amzn1.account.AHOLJ3V5GFH6K5RFNQGJINFSJZWQ/ref=cm_cr_getr_d_gw_btm?ie=UTF8,2020-09-28 19:58:43.186353,2020-09-28 19:58:43.301520,Hanes Mens Graphic Tee - Humor T-Shirt,4.6,,Clothing & Accessories,B01EKB6BMU,Hanes Men's Athletic Child Code,293
136,AFJ6MCNLRWOUANCRIHLFBHA2HHRQ,True,Ok,Ok,"December 23, 2018",Isabelle Giguere ,4.0,0,https://www.amazon.ca/gp/profile/amzn1.account.AFJ6MCNLRWOUANCRIHLFBHA2HHRQ/ref=cm_cr_getr_d_gw_btm?ie=UTF8,2020-09-28 19:58:43.305424,2020-09-28 19:58:43.445969,Hanes Mens Graphic Tee - Humor T-Shirt,4.6,,Clothing & Accessories,B01EKB6BMU,Hanes Men's Athletic Child Code,293
137,AH3LCPOVUQF2OATY3YICDROCXJ7Q,True,Good product,Good product and funny,"July 1, 2020",Nina,5.0,0,https://www.amazon.ca/gp/profile/amzn1.account.AH3LCPOVUQF2OATY3YICDROCXJ7Q/ref=cm_cr_getr_d_gw_btm?ie=UTF8,2020-09-28 19:58:43.449872,2020-09-28 19:58:43.571872,Hanes Mens Graphic Tee - Humor T-Shirt,4.6,,Clothing & Accessories,B01EKB6BMU,Hanes Men's Athletic Child Code,293
138,AH3RDK6JUYVNCVFHX6RRRPMLPM7A,True,legnth,the shirt was not as big as expected,"July 14, 2019",debbie,5.0,0,https://www.amazon.ca/gp/profile/amzn1.account.AH3RDK6JUYVNCVFHX6RRRPMLPM7A/ref=cm_cr_getr_d_gw_btm?ie=UTF8,2020-09-28 19:58:43.575775,2020-09-28 19:58:43.701680,Hanes Mens Graphic Tee - Humor T-Shirt,4.6,,Clothing & Accessories,B01EKB6BMU,Hanes Men's Athletic Child Code,293
139,AFMEU2OAZ54J6IMMTLGSMQITQKRQ,True,The fit was perfect,Love it,"June 4, 2020",Cindy P.,5.0,0,https://www.amazon.ca/gp/profile/amzn1.account.AFMEU2OAZ54J6IMMTLGSMQITQKRQ/ref=cm_cr_getr_d_gw_btm?ie=UTF8,2020-09-28 19:58:43.705583,2020-09-28 19:58:43.856863,Hanes Mens Graphic Tee - Humor T-Shirt,4.6,,Clothing & Accessories,B01EKB6BMU,Hanes Men's Athletic Child Code,293
140,AETFW45NH4YOM3QOXPKPG4NAOYMA,True,Parfait,Il fait bien à mon copain,"February 3, 2019",MarieP,5.0,0,https://www.amazon.ca/gp/profile/amzn1.account.AETFW45NH4YOM3QOXPKPG4NAOYMA/ref=cm_cr_getr_d_gw_btm?ie=UTF8,2020-09-28 19:58:49.022858,2020-09-28 19:58:49.183896,Hanes Mens Graphic Tee - Humor T-Shirt,4.6,,Clothing & Accessories,B01EKB6BMU,Hanes Men's Athletic Child Code,293
141,AE5XBTLY4GPL7U3CWJLR4MS3HGZA,True,T-shirt,Bon rapport qualité prix,"April 10, 2019",PierreL,4.0,0,https://www.amazon.ca/gp/profile/amzn1.account.AE5XBTLY4GPL7U3CWJLR4MS3HGZA/ref=cm_cr_getr_d_gw_btm?ie=UTF8,2020-09-28 19:58:49.187803,2020-09-28 19:58:49.309800,Hanes Mens Graphic Tee - Humor T-Shirt,4.6,,Clothing & Accessories,B01EKB6BMU,Hanes Men's Athletic Child Code,293
142,AGVYEXPHSVIYZT3UCVLMW4VQ47KQ,True,Produits bonne taille,Très bon produit,"February 4, 2020",olivier leclerc,5.0,0,https://www.amazon.ca/gp/profile/amzn1.account.AGVYEXPHSVIYZT3UCVLMW4VQ47KQ/ref=cm_cr_getr_d_gw_btm?ie=UTF8,2020-09-28 19:58:49.313705,2020-09-28 19:58:49.436718,Hanes Mens Graphic Tee - Humor T-Shirt,4.6,,Clothing & Accessories,B01EKB6BMU,Hanes Men's Athletic Child Code,293
143,AEU54RGX6MGHPLZGUOH5V35I75RQ,True,good but I need one size smaller,It's good but to big,"May 6, 2020",Hillary,4.0,0,https://www.amazon.ca/gp/profile/amzn1.account.AEU54RGX6MGHPLZGUOH5V35I75RQ/ref=cm_cr_getr_d_gw_btm?ie=UTF8,2020-09-28 19:58:49.441623,2020-09-28 19:58:49.587048,Hanes Mens Graphic Tee - Humor T-Shirt,4.6,,Clothing & Accessories,B01EKB6BMU,Hanes Men's Athletic Child Code,293
144,AFTZ5TAQAHJQODKCTWGPKINUCXEQ,True,ordinary,plain simple T shirt,"August 29, 2020",Amazon Customer,1.0,0,https://www.amazon.ca/gp/profile/amzn1.account.AFTZ5TAQAHJQODKCTWGPKINUCXEQ/ref=cm_cr_getr_d_gw_btm?ie=UTF8,2020-09-28 19:58:49.591928,2020-09-28 19:58:49.716856,Hanes Mens Graphic Tee - Humor T-Shirt,4.6,,Clothing & Accessories,B01EKB6BMU,Hanes Men's Athletic Child Code,293
145,AFPRJWGMNRJZ2QX74YJXFM65UFEA,True,The shirt fit,As expected.,"August 31, 2019",Glenn Thompson,5.0,0,https://www.amazon.ca/gp/profile/amzn1.account.AFPRJWGMNRJZ2QX74YJXFM65UFEA/ref=cm_cr_getr_d_gw_btm?ie=UTF8,2020-09-28 19:58:49.722711,2020-09-28 19:58:49.852519,Hanes Mens Graphic Tee - Humor T-Shirt,4.6,,Clothing & Accessories,B01EKB6BMU,Hanes Men's Athletic Child Code,293
146,AFNQNFC7D3Q3J4H5RPVDS4CYHPIQ,True,,,"December 19, 2019",Jean-François,4.0,0,https://www.amazon.ca/gp/profile/amzn1.account.AFNQNFC7D3Q3J4H5RPVDS4CYHPIQ/ref=cm_cr_getr_d_gw_btm?ie=UTF8,2020-09-28 19:58:49.857398,2020-09-28 19:58:50.003842,Hanes Mens Graphic Tee - Humor T-Shirt,4.6,,Clothing & Accessories,B01EKB6BMU,Hanes Men's Athletic Child Code,293
147,AENM55ZEVOELXBCN6H7NFHE3ZMNA,True,Not satisfied,Willing to return,"July 31, 2019",Rajeev,5.0,0,https://www.amazon.ca/gp/profile/amzn1.account.AENM55ZEVOELXBCN6H7NFHE3ZMNA/ref=cm_cr_getr_d_gw_btm?ie=UTF8,2020-09-28 19:58:50.007746,2020-09-28 19:58:50.129783,Hanes Mens Graphic Tee - Humor T-Shirt,4.6,,Clothing & Accessories,B01EKB6BMU,Hanes Men's Athletic Child Code,293
148,AFX3NNLJPBEC3PMNZFJACON3VKIQ,True,Sizing is right.,Shirt fit my son well.,"January 22, 2020",Angela Martin,5.0,0,https://www.amazon.ca/gp/profile/amzn1.account.AFX3NNLJPBEC3PMNZFJACON3VKIQ/ref=cm_cr_getr_d_gw_btm?ie=UTF8,2020-09-28 19:58:50.134662,2020-09-28 19:58:50.255688,Hanes Mens Graphic Tee - Humor T-Shirt,4.6,,Clothing & Accessories,B01EKB6BMU,Hanes Men's Athletic Child Code,293
149,AFS4V7NIZ5XPHSH62OMHVUEMZLPQ,True,Fit great,Loved it,"July 9, 2018",Tina McGarr,5.0,0,https://www.amazon.ca/gp/profile/amzn1.account.AFS4V7NIZ5XPHSH62OMHVUEMZLPQ/ref=cm_cr_getr_d_gw_btm?ie=UTF8,2020-09-28 19:58:50.260591,2020-09-28 19:58:50.411846,Hanes Mens Graphic Tee - Humor T-Shirt,4.6,,Clothing & Accessories,B01EKB6BMU,Hanes Men's Athletic Child Code,293
150,AERVC7EMLFQ2XEO4QKBFGHHNKDAQ,True,Quick delivery,Great,"June 14, 2020",Kindle Customer,5.0,0,https://www.amazon.ca/gp/profile/amzn1.account.AERVC7EMLFQ2XEO4QKBFGHHNKDAQ/ref=cm_cr_getr_d_gw_btm?ie=UTF8,2020-09-28 19:58:53.577440,2020-09-28 19:58:53.732665,Hanes Mens Graphic Tee - Humor T-Shirt,4.6,,Clothing & Accessories,B01EKB6BMU,Hanes Men's Athletic Child Code,293
151,AGG3QQ3XX4E3WFIY47DTSQSOI2ZA,True,Prendre une grandeur de plus lors de l’achat,Gilet juste,"June 12, 2019",Alexandre Lessard,4.0,0,https://www.amazon.ca/gp/profile/amzn1.account.AGG3QQ3XX4E3WFIY47DTSQSOI2ZA/ref=cm_cr_getr_d_gw_btm?ie=UTF8,2020-09-28 19:58:53.737543,2020-09-28 19:58:53.859543,Hanes Mens Graphic Tee - Humor T-Shirt,4.6,,Clothing & Accessories,B01EKB6BMU,Hanes Men's Athletic Child Code,293
152,AFP7SPCRA2NOFRFXMEZBUEE45BVA,True,great gift,"Bought it for my dad, he thought it hilarious","January 11, 2018",kaitlyn,5.0,0,https://www.amazon.ca/gp/profile/amzn1.account.AFP7SPCRA2NOFRFXMEZBUEE45BVA/ref=cm_cr_getr_d_gw_btm?ie=UTF8,2020-09-28 19:58:53.863447,2020-09-28 19:58:53.984470,Hanes Mens Graphic Tee - Humor T-Shirt,4.6,,Clothing & Accessories,B01EKB6BMU,Hanes Men's Athletic Child Code,293
153,AFMVFYWKSSXSK43ROKHQCPR4XICQ,True,Bon tissus,Original.,"November 30, 2018",Client d'Amazon,5.0,0,https://www.amazon.ca/gp/profile/amzn1.account.AFMVFYWKSSXSK43ROKHQCPR4XICQ/ref=cm_cr_getr_d_gw_btm?ie=UTF8,2020-09-28 19:58:53.989351,2020-09-28 19:58:54.136727,Hanes Mens Graphic Tee - Humor T-Shirt,4.6,,Clothing & Accessories,B01EKB6BMU,Hanes Men's Athletic Child Code,293
154,AG7RBIPHZG3GAM5YCV355AIB4KUQ,True,T-shirt,The shirt material is nice and sturdy and the words are perfect with no flaws,"December 5, 2017",Misty Robicheau,4.0,0,https://www.amazon.ca/gp/profile/amzn1.account.AG7RBIPHZG3GAM5YCV355AIB4KUQ/ref=cm_cr_getr_d_gw_btm?ie=UTF8,2020-09-28 19:58:54.140630,2020-09-28 19:58:54.260677,Hanes Mens Graphic Tee - Humor T-Shirt,4.6,,Clothing & Accessories,B01EKB6BMU,Hanes Men's Athletic Child Code,293
155,AEM633KRR4NAQKFN7Q2CWQDD2C3Q,True,Parfait pour ma taille,Solide,"July 29, 2020",emmanuel,5.0,0,https://www.amazon.ca/gp/profile/amzn1.account.AEM633KRR4NAQKFN7Q2CWQDD2C3Q/ref=cm_cr_getr_d_gw_btm?ie=UTF8,2020-09-28 19:58:54.265558,2020-09-28 19:58:54.385605,Hanes Mens Graphic Tee - Humor T-Shirt,4.6,,Clothing & Accessories,B01EKB6BMU,Hanes Men's Athletic Child Code,293
156,AHCPJSXAUSK5MWFHQGEJXO4OVPDQ,True,Good material,Arrived quicker than advertised. Good material,"December 10, 2017",Melanie Heath,5.0,0,https://www.amazon.ca/gp/profile/amzn1.account.AHCPJSXAUSK5MWFHQGEJXO4OVPDQ/ref=cm_cr_getr_d_gw_btm?ie=UTF8,2020-09-28 19:58:54.390486,2020-09-28 19:58:54.536911,Hanes Mens Graphic Tee - Humor T-Shirt,4.6,,Clothing & Accessories,B01EKB6BMU,Hanes Men's Athletic Child Code,293
157,AEBE7UGTQFHSKTFO2L47QKSG3M7Q,True,As described,As described,"July 17, 2020",Nicole Jepp,5.0,0,https://www.amazon.ca/gp/profile/amzn1.account.AEBE7UGTQFHSKTFO2L47QKSG3M7Q/ref=cm_cr_getr_d_gw_btm?ie=UTF8,2020-09-28 19:58:54.542767,2020-09-28 19:58:54.667702,Hanes Mens Graphic Tee - Humor T-Shirt,4.6,,Clothing & Accessories,B01EKB6BMU,Hanes Men's Athletic Child Code,293
158,AFWTOG44A2H3SJOLWPT4D7TTHNFQ,True,Four Stars,Correct,"December 30, 2017",René B.,4.0,0,https://www.amazon.ca/gp/profile/amzn1.account.AFWTOG44A2H3SJOLWPT4D7TTHNFQ/ref=cm_cr_getr_d_gw_btm?ie=UTF8,2020-09-28 19:58:54.672581,2020-09-28 19:58:54.804340,Hanes Mens Graphic Tee - Humor T-Shirt,4.6,,Clothing & Accessories,B01EKB6BMU,Hanes Men's Athletic Child Code,293
159,AG6S2W4X26CWA7OVFNFNPFUHODYA,True,tee humor,Good quality,"January 16, 2018",Mary Austen,4.0,0,https://www.amazon.ca/gp/profile/amzn1.account.AG6S2W4X26CWA7OVFNFNPFUHODYA/ref=cm_cr_getr_d_gw_btm?ie=UTF8,2020-09-28 19:58:54.808245,2020-09-28 19:58:54.933174,Hanes Mens Graphic Tee - Humor T-Shirt,4.6,,Clothing & Accessories,B01EKB6BMU,Hanes Men's Athletic Child Code,293
160,AGS4GCE2O2THAOGIGU7SLOXIL4RA,False,Fits as wanted,"I was hesitant on buying a shirt on amazon, since I read a lot of reviews stating the sizes aren’t always good. I was looking for a snug fit shirt and this was perfect for me.","December 14, 2017",Acadianer,4.0,0,https://www.amazon.ca/gp/profile/amzn1.account.AGS4GCE2O2THAOGIGU7SLOXIL4RA/ref=cm_cr_getr_d_gw_btm?ie=UTF8,2020-09-28 19:58:59.063098,2020-09-28 19:58:59.197786,Hanes Mens Graphic Tee - Humor T-Shirt,4.6,,Clothing & Accessories,B01EKB6BMU,Hanes Men's Athletic Child Code,293
161,AHJTWHRT2P7DWYFBVQZAI3LTNIMQ,False,"Just as described, fits small",Fast delivery looks just like picture,"December 13, 2018",elizabeth shey,5.0,0,https://www.amazon.ca/gp/profile/amzn1.account.AHJTWHRT2P7DWYFBVQZAI3LTNIMQ/ref=cm_cr_getr_d_gw_btm?ie=UTF8,2020-09-28 19:58:59.202693,2020-09-28 19:58:59.347113,Hanes Mens Graphic Tee - Humor T-Shirt,4.6,,Clothing & Accessories,B01EKB6BMU,Hanes Men's Athletic Child Code,293
162,AHNZWDTEJAZRU3Z4VXOBE3N3VTGA,False,Wonderful cloth and comfortable fit,"Great cloth quality, as expected from Hanes. Very comfortable and love it.","August 12, 2018",Navjot Singh Gahley,4.0,0,https://www.amazon.ca/gp/profile/amzn1.account.AHNZWDTEJAZRU3Z4VXOBE3N3VTGA/ref=cm_cr_getr_d_gw_btm?ie=UTF8,2020-09-28 19:58:59.352969,2020-09-28 19:58:59.466185,Hanes Mens Graphic Tee - Humor T-Shirt,4.6,,Clothing & Accessories,B01EKB6BMU,Hanes Men's Athletic Child Code,293
163,AF7K5XEUVEJXHCHKWTXVXLDEOKJQ,False,great quality,love the shirt,"June 13, 2019",Paul Bramwell,5.0,0,https://www.amazon.ca/gp/profile/amzn1.account.AF7K5XEUVEJXHCHKWTXVXLDEOKJQ/ref=cm_cr_getr_d_gw_btm?ie=UTF8,2020-09-28 19:58:59.470090,2020-09-28 19:58:59.584282,Hanes Mens Graphic Tee - Humor T-Shirt,4.6,,Clothing & Accessories,B01EKB6BMU,Hanes Men's Athletic Child Code,293
164,AHUJAX7ULXMUR4NADTAQAJQITUNA,False,Fast delivery,Seemed smaller then excepted,"May 12, 2020",Janice,3.0,0,https://www.amazon.ca/gp/profile/amzn1.account.AHUJAX7ULXMUR4NADTAQAJQITUNA/ref=cm_cr_getr_d_gw_btm?ie=UTF8,2020-09-28 19:58:59.588184,2020-09-28 19:58:59.703351,Hanes Mens Graphic Tee - Humor T-Shirt,4.6,,Clothing & Accessories,B01EKB6BMU,Hanes Men's Athletic Child Code,293
165,AGPHZQ3SL5NLVVIVPFHHBOY3U4NQ,False,Perfect,Got what I asked for,"May 7, 2020",Chris Curtis,5.0,0,https://www.amazon.ca/gp/profile/amzn1.account.AGPHZQ3SL5NLVVIVPFHHBOY3U4NQ/ref=cm_cr_getr_d_gw_btm?ie=UTF8,2020-09-28 19:58:59.707255,2020-09-28 19:58:59.827304,Hanes Mens Graphic Tee - Humor T-Shirt,4.6,,Clothing & Accessories,B01EKB6BMU,Hanes Men's Athletic Child Code,293
166,AEPUL43HK7MXP55S7OLM5SN6RPPQ,True,super cool et drole,beau produit. qualité ok. cependant le chandail est fait LONG .. si non ca va,"September 18, 2019",Mario B.,5.0,0,https://www.amazon.ca/gp/profile/amzn1.account.AEPUL43HK7MXP55S7OLM5SN6RPPQ/ref=cm_cr_getr_d_gw_btm?ie=UTF8,2020-09-28 19:58:59.832184,2020-09-28 19:58:59.956135,Hanes Mens Graphic Tee - Humor T-Shirt,4.6,,Clothing & Accessories,B01EKB6BMU,Hanes Men's Athletic Child Code,293
167,AFWO3WJZYUTMJ6G2WSBTBP55PLYQ,True,Funny and good quality,"Excellent quality
Purchased small for my teenage son","March 11, 2019",Amazon Customer,5.0,0,https://www.amazon.ca/gp/profile/amzn1.account.AFWO3WJZYUTMJ6G2WSBTBP55PLYQ/ref=cm_cr_getr_d_gw_btm?ie=UTF8,2020-09-28 19:58:59.960040,2020-09-28 19:59:00.118151,Hanes Mens Graphic Tee - Humor T-Shirt,4.6,,Clothing & Accessories,B01EKB6BMU,Hanes Men's Athletic Child Code,293
168,AET62DOVBKOBDQ37M5W7WWY7N2DQ,True,Yay!,"Well made, fits as expected and funny :)","February 16, 2019",Allison J,5.0,0,https://www.amazon.ca/gp/profile/amzn1.account.AET62DOVBKOBDQ37M5W7WWY7N2DQ/ref=cm_cr_getr_d_gw_btm?ie=UTF8,2020-09-28 19:59:00.122055,2020-09-28 19:59:00.246983,Hanes Mens Graphic Tee - Humor T-Shirt,4.6,,Clothing & Accessories,B01EKB6BMU,Hanes Men's Athletic Child Code,293
169,AFYLPPO367AGNOIU7AMUPH4XSNDA,True,Nice neck line.,Great quality,"July 31, 2019",Wendy,5.0,0,https://www.amazon.ca/gp/profile/amzn1.account.AFYLPPO367AGNOIU7AMUPH4XSNDA/ref=cm_cr_getr_d_gw_btm?ie=UTF8,2020-09-28 19:59:00.250886,2020-09-28 19:59:00.371981,Hanes Mens Graphic Tee - Humor T-Shirt,4.6,,Clothing & Accessories,B01EKB6BMU,Hanes Men's Athletic Child Code,293
170,AERU4UMPWMLZZKCAY57GN54Y4LXA,True,Thanks,A+,"February 9, 2019",Rhonda Gee-O'Connor,5.0,0,https://www.amazon.ca/gp/profile/amzn1.account.AERU4UMPWMLZZKCAY57GN54Y4LXA/ref=cm_cr_getr_d_gw_btm?ie=UTF8,2020-09-28 19:59:02.467720,2020-09-28 19:59:02.605337,Hanes Mens Graphic Tee - Humor T-Shirt,4.6,,Clothing & Accessories,B01EKB6BMU,Hanes Men's Athletic Child Code,293
171,AE3XFTRJCDITACR32GIWUZTPPBYA,True,Five Stars,"Great value, great quality!","December 4, 2017",Mary Knox,5.0,0,https://www.amazon.ca/gp/profile/amzn1.account.AE3XFTRJCDITACR32GIWUZTPPBYA/ref=cm_cr_getr_d_gw_btm?ie=UTF8,2020-09-28 19:59:02.609240,2020-09-28 19:59:02.748807,Hanes Mens Graphic Tee - Humor T-Shirt,4.6,,Clothing & Accessories,B01EKB6BMU,Hanes Men's Athletic Child Code,293
172,AGXCHDFNHADIYENYWUBUHRNQXRIA,True,Humor,Good quality.,"August 4, 2020",Angela Johnson,4.0,0,https://www.amazon.ca/gp/profile/amzn1.account.AGXCHDFNHADIYENYWUBUHRNQXRIA/ref=cm_cr_getr_d_gw_btm?ie=UTF8,2020-09-28 19:59:02.754664,2020-09-28 19:59:02.924488,Hanes Mens Graphic Tee - Humor T-Shirt,4.6,,Clothing & Accessories,B01EKB6BMU,Hanes Men's Athletic Child Code,293
