Unnamed: 0,author_id,verified_purchase,review_title,reviews,date,reviewer_name,ratings,people_find_helpful,reviewer_profile_url,start_time,end_time,product_name,average_rating,total_reviews,product_category,product_id,brand_name,rank
0,AHCY25BQMRP2LOAGAWVBHAHBALRQ,True,Best T-Shirt I've Ever Owned - Just Order One Size DOWN From What You Usually Wear...Unless....,"Before I ordered this, I truly thought it would be a Frosty Friday in July before I would EVER spend $35 on a single T-Shirt. I only discovered Carhartt just before Christmas, and after the rave reviews I got from people who owned them, I thought I'd give it a whirl. So glad I did! These are 100% Big Baller, Heavy Hauler shirts for sure, and they are made for the working man, no doubt about it! When they say it's a 6.75 ounce T-Shirt, they're not kidding! This is a quality, thick, durable, and well made T-Shirt, it's not your average T-Shirt that is almost see-through! It is the most comfortable T-Shirt I own, and I own an entire drawer full of them!

One thing to note, is they fit BIG! This is not a negative at all, but when you understand that these are shirts made for men that work outside with their hands and strength, they are intended for you to be able to hold up both your arms (like when lifting a roof truss with your bare hands) and the shoulder and arms won't bind, and the bottom won't ride up to show off your manly mid-drift! That is why they fit on the large size.

If you're not a hard working outdoors man, and you just want to have a really, really comfortable T-shirt and pretend you're a Baller, and won't be extending your arms upward that often, then get one size SMALLER than you usually take in a T-Shirt and you'll be golden!

If you're on the fence about getting one of these $35 T-Shirts, and you're used to just getting free T-Shirts or not spending more than about $7 for one all your life, just accept this small challenge from me and buy JUST ONE and see what you think! Heck, Amazon offers free returns, so there is nothing to lose here! My bet is you'll fall in love with these T-Shirts!

6 months ago I would have scoffed at anyone who suggested I pay $35 for a T-Shirt. To me, that was almost as bad as those who spend $50 on some Ed Hardy paper thin shirt just to be cool. But after getting a REAL QUALITY shirt that is more comfortable than any T-Shirt I've ever owned, you'll see what I mean! I actually own 5 of these now! Never thought I'd see the day, but here we are!! 5 of them!!! And probably more to come soon!","February 17, 2020",Verminator,5.0,0,https://www.amazon.ca/gp/profile/amzn1.account.AHCY25BQMRP2LOAGAWVBHAHBALRQ/ref=cm_cr_arp_d_gw_btm?ie=UTF8,2020-09-28 19:54:48.617702,2020-09-28 19:54:48.784597,Carhartt Men's Signature Logo Short Sleeve T-Shirt (Regular and Big & Tall Sizes),4.4,,Clothing & Accessories,B06VX1N13N,Carhartt Sportswear - Mens,516
1,AFR6VU2EOMF5ZQCK2JXEKQFJ3BAA,True,Size chart is not good!,"Quality looks so nice! Pretty sure the shirt will last.

BUT, if you look at the size chart, you will have to reorder, like I did. I was looking for a 54-56 inches for the chest. In the size chart, you can see you have to order a 3XL. When I tried the tshirt, I was floating in it! Took the mesurements and found out it was 60 inches! So, I reordered a 2XL... Will see!","July 2, 2020",Jean-François Deschênes,3.0,0,https://www.amazon.ca/gp/profile/amzn1.account.AFR6VU2EOMF5ZQCK2JXEKQFJ3BAA/ref=cm_cr_arp_d_gw_btm?ie=UTF8,2020-09-28 19:54:48.790452,2020-09-28 19:54:48.955397,Carhartt Men's Signature Logo Short Sleeve T-Shirt (Regular and Big & Tall Sizes),4.4,,Clothing & Accessories,B06VX1N13N,Carhartt Sportswear - Mens,516
2,AGLCPRPRNAZAD3BYQVBGV2JBCKHA,True,Really big...,"Maybe mine got the wrong tag? I ordered the large, and immediately noticed it was bigger than many xl shirts I own. I opted to try to shrink it which was a mistake and should probably have returned it because even after going through the wash and dryer on hot a couple times, I am swimming in the shirt. It hangs down past my crotch.. it’s really unfortunate because it is a nice thick and really well made shirt.","May 5, 2019",Dan,3.0,0,https://www.amazon.ca/gp/profile/amzn1.account.AGLCPRPRNAZAD3BYQVBGV2JBCKHA/ref=cm_cr_arp_d_gw_btm?ie=UTF8,2020-09-28 19:54:48.960277,2020-09-28 19:54:49.150596,Carhartt Men's Signature Logo Short Sleeve T-Shirt (Regular and Big & Tall Sizes),4.4,,Clothing & Accessories,B06VX1N13N,Carhartt Sportswear - Mens,516
3,AHRHOC3M4O6AELVIEI6GDDYZMUWQ,True,Tooooo big,I normally wear 3xlt I’m 6’4 380 pounds i normally wear this size cause I have a long torso and wide shoulders but came to my surprise when I put this shirt on and it was a dress on me. I love the feel. I’ll probably order a 3xl to see if that works,"May 28, 2019",Matthew,2.0,1,https://www.amazon.ca/gp/profile/amzn1.account.AHRHOC3M4O6AELVIEI6GDDYZMUWQ/ref=cm_cr_arp_d_gw_btm?ie=UTF8,2020-09-28 19:54:49.156452,2020-09-28 19:54:49.315540,Carhartt Men's Signature Logo Short Sleeve T-Shirt (Regular and Big & Tall Sizes),4.4,,Clothing & Accessories,B06VX1N13N,Carhartt Sportswear - Mens,516
4,AGJ27O7V7N33U5SU6CNXWJZNJSSQ,True,Differences between same shirt and the different colors,"Couldn't pick how it fit as it was just really weird. Overall the size was correct it just didn't sit or feel like the other colors I've bought. The neck on this one was oddly snug, uncomfortably so. Will be sending back. Not sure why this shirt with this seemingly good brand is not consistent with this shirt.","December 26, 2018",Halee,1.0,0,https://www.amazon.ca/gp/profile/amzn1.account.AGJ27O7V7N33U5SU6CNXWJZNJSSQ/ref=cm_cr_arp_d_gw_btm?ie=UTF8,2020-09-28 19:54:49.320420,2020-09-28 19:54:49.482435,Carhartt Men's Signature Logo Short Sleeve T-Shirt (Regular and Big & Tall Sizes),4.4,,Clothing & Accessories,B06VX1N13N,Carhartt Sportswear - Mens,516
5,AEB7N7CHXLTVWFRU4DCLUJCSCEXQ,True,Order 2 sizes down!,"Quality of shirt is amazing. Would have gave it 5 stars but the sizing is way off. I usually wear a 2x in most brands. Ordered a large tall (2 sizes down but long) because i know the sizing is always way off with carhartt. It fits well, loose in the sleeves. Im certain a medium would fit me even though im 6ft tall 215 lbs.","August 5, 2020",Earl Kubas,4.0,0,https://www.amazon.ca/gp/profile/amzn1.account.AEB7N7CHXLTVWFRU4DCLUJCSCEXQ/ref=cm_cr_arp_d_gw_btm?ie=UTF8,2020-09-28 19:54:49.488292,2020-09-28 19:54:49.662995,Carhartt Men's Signature Logo Short Sleeve T-Shirt (Regular and Big & Tall Sizes),4.4,,Clothing & Accessories,B06VX1N13N,Carhartt Sportswear - Mens,516
6,AGUOFYXONG3XT2XL7GKZPDO3CY6A,True,Great quality work apparel!,Bought this shirt for my family members as they all need strong work apparel. They are super thick quality and will definitely be long lasting. Will definitely purchase again!,"January 24, 2020",Karen Baldwin,5.0,0,https://www.amazon.ca/gp/profile/amzn1.account.AGUOFYXONG3XT2XL7GKZPDO3CY6A/ref=cm_cr_arp_d_gw_btm?ie=UTF8,2020-09-28 19:54:49.667875,2020-09-28 19:54:49.809394,Carhartt Men's Signature Logo Short Sleeve T-Shirt (Regular and Big & Tall Sizes),4.4,,Clothing & Accessories,B06VX1N13N,Carhartt Sportswear - Mens,516
7,AEIK3RJDM5IKLZIJ3AQT5D6KFJQA,True,The Tall is really tall,"quality is as I was expecting from carhartt, very good, I wasnot expecting how long it was, I'm 6'4"" and the tall version goes all the way down to my thighs.","March 11, 2020",Jesse Hayes,4.0,0,https://www.amazon.ca/gp/profile/amzn1.account.AEIK3RJDM5IKLZIJ3AQT5D6KFJQA/ref=cm_cr_arp_d_gw_btm?ie=UTF8,2020-09-28 19:54:49.813298,2020-09-28 19:54:49.940178,Carhartt Men's Signature Logo Short Sleeve T-Shirt (Regular and Big & Tall Sizes),4.4,,Clothing & Accessories,B06VX1N13N,Carhartt Sportswear - Mens,516
8,AGCJ3IWADVS74YZOHLARRSJ7R6AA,True,Great product!,"Got this in the mail today. Looks great and is very comfy. Upon reading other review, it said to order a size down. Unfortunately after doing that, the shirt was to small. I have since ordered up a size. Worth the money!","July 31, 2020",Sharon ,5.0,0,https://www.amazon.ca/gp/profile/amzn1.account.AGCJ3IWADVS74YZOHLARRSJ7R6AA/ref=cm_cr_arp_d_gw_btm?ie=UTF8,2020-09-28 19:54:49.945059,2020-09-28 19:54:50.086578,Carhartt Men's Signature Logo Short Sleeve T-Shirt (Regular and Big & Tall Sizes),4.4,,Clothing & Accessories,B06VX1N13N,Carhartt Sportswear - Mens,516
9,AHWBJABZGKX4VOH5RO2BNB4EALOQ,True,These shirts must be from their big and tall line,"I'm 5'11"" and 185lbs
medium shirts have always been a tighter fit on me so when i read the reviews saying to go a size smaller assumed if i ordered a size medium that it would feel as if the shirt would fit like a large and still fit me... It's huge nearly goes down to my knees, i honestly don't understand where carthart gets its sizing from. I feel like a size small would still be too big.","July 2, 2019",Mark M.,3.0,0,https://www.amazon.ca/gp/profile/amzn1.account.AHWBJABZGKX4VOH5RO2BNB4EALOQ/ref=cm_cr_arp_d_gw_btm?ie=UTF8,2020-09-28 19:54:50.090483,2020-09-28 19:54:50.231026,Carhartt Men's Signature Logo Short Sleeve T-Shirt (Regular and Big & Tall Sizes),4.4,,Clothing & Accessories,B06VX1N13N,Carhartt Sportswear - Mens,516
10,AGORX647I2HITMXWLYSCATDJMG2A,True,"Good quality, just larger size wise",This is a great shirt. The material is a good thicker material. However I ordered a 2xl in tall for my husband and it was huge. More like a 3 to 4 xl. So I say just size down and you should be good to go .,"July 2, 2020",Natasha Bird,5.0,0,https://www.amazon.ca/gp/profile/amzn1.account.AGORX647I2HITMXWLYSCATDJMG2A/ref=cm_cr_getr_d_gw_btm?ie=UTF8,2020-09-28 19:54:53.446388,2020-09-28 19:54:53.580098,Carhartt Men's Signature Logo Short Sleeve T-Shirt (Regular and Big & Tall Sizes),4.4,,Clothing & Accessories,B06VX1N13N,Carhartt Sportswear - Mens,516
11,AE3OSRY4K4CRKMMSQ5JKISQYOHUA,True,Sizes all over the map,"Carrhart need to get their heads out of their ass when it come to sizing. I looked at the exact same shirt I was wearing which fits perfect and ordered the exact same size, XL Tall. Got three of these shirts today and it's like wearing a dress. NOT IMPRESSED!","February 4, 2020",Brett,3.0,0,https://www.amazon.ca/gp/profile/amzn1.account.AE3OSRY4K4CRKMMSQ5JKISQYOHUA/ref=cm_cr_getr_d_gw_btm?ie=UTF8,2020-09-28 19:54:53.584003,2020-09-28 19:54:53.706978,Carhartt Men's Signature Logo Short Sleeve T-Shirt (Regular and Big & Tall Sizes),4.4,,Clothing & Accessories,B06VX1N13N,Carhartt Sportswear - Mens,516
12,AGGSJE3Q2JYKZE4GRPAG6D7FVJZA,True,High quality comfort,Great high quality shirt. I have always struggled to find a shirt long enough without being XXL. Being 5’10” and 230 most shirts are with too bulky or sausage casings. Large Long fits comfortably.,"August 6, 2020",Amazon Customer,5.0,0,https://www.amazon.ca/gp/profile/amzn1.account.AGGSJE3Q2JYKZE4GRPAG6D7FVJZA/ref=cm_cr_getr_d_gw_btm?ie=UTF8,2020-09-28 19:54:53.710881,2020-09-28 19:54:53.845569,Carhartt Men's Signature Logo Short Sleeve T-Shirt (Regular and Big & Tall Sizes),4.4,,Clothing & Accessories,B06VX1N13N,Carhartt Sportswear - Mens,516
13,AHYWMIOFZ43665TJNHEODZT5476A,True,Larger than expected,Bought a medium as a gift for someone and I cannot get over how huge it is! Quality is great though,"September 8, 2020",Heather ,4.0,0,https://www.amazon.ca/gp/profile/amzn1.account.AHYWMIOFZ43665TJNHEODZT5476A/ref=cm_cr_getr_d_gw_btm?ie=UTF8,2020-09-28 19:54:53.850450,2020-09-28 19:54:53.966594,Carhartt Men's Signature Logo Short Sleeve T-Shirt (Regular and Big & Tall Sizes),4.4,,Clothing & Accessories,B06VX1N13N,Carhartt Sportswear - Mens,516
14,AFQZIMADZUBWB7XHQNB3DF75FI2A,True,great shirt,"I am a big fan of Carhart the shirt fits and feels like you think it would, its a soft comfy tshirt and thick for great durability","July 7, 2019",Justin,5.0,0,https://www.amazon.ca/gp/profile/amzn1.account.AFQZIMADZUBWB7XHQNB3DF75FI2A/ref=cm_cr_getr_d_gw_btm?ie=UTF8,2020-09-28 19:54:53.970497,2020-09-28 19:54:54.089569,Carhartt Men's Signature Logo Short Sleeve T-Shirt (Regular and Big & Tall Sizes),4.4,,Clothing & Accessories,B06VX1N13N,Carhartt Sportswear - Mens,516
15,AGHV3QUCCRWBB5NYH76SE32MGLTA,True,High quality product,The t shirt was awesome just the feel of it was different because cirhart is high quality and seriously recommend highly to friends and family I bought one about 5 years ago working construction,"September 5, 2020",jamboo88,5.0,0,https://www.amazon.ca/gp/profile/amzn1.account.AGHV3QUCCRWBB5NYH76SE32MGLTA/ref=cm_cr_getr_d_gw_btm?ie=UTF8,2020-09-28 19:54:54.093473,2020-09-28 19:54:54.213521,Carhartt Men's Signature Logo Short Sleeve T-Shirt (Regular and Big & Tall Sizes),4.4,,Clothing & Accessories,B06VX1N13N,Carhartt Sportswear - Mens,516
16,AFY654MKASRROO3UFUMGHDGGKEBQ,True,Best quality you find,That brand is so mutch good quality product best quality i see in my life for t-shirt,"July 10, 2020",Christian Bergeron,5.0,0,https://www.amazon.ca/gp/profile/amzn1.account.AFY654MKASRROO3UFUMGHDGGKEBQ/ref=cm_cr_getr_d_gw_btm?ie=UTF8,2020-09-28 19:54:54.217424,2020-09-28 19:54:54.335520,Carhartt Men's Signature Logo Short Sleeve T-Shirt (Regular and Big & Tall Sizes),4.4,,Clothing & Accessories,B06VX1N13N,Carhartt Sportswear - Mens,516
17,AHPTVRXUX2WOZT5CB47FXNKBAIRA,True,Fits LARGER than expected.,My bf loves Carhartt products and this shirt was usual high production standard. But the large is DEFINITELY an x-large sizing. Unfortunately I jumped the gun and washed it before he tried it on.,"July 10, 2019",MN Lee,5.0,0,https://www.amazon.ca/gp/profile/amzn1.account.AHPTVRXUX2WOZT5CB47FXNKBAIRA/ref=cm_cr_getr_d_gw_btm?ie=UTF8,2020-09-28 19:54:54.339424,2020-09-28 19:54:54.459471,Carhartt Men's Signature Logo Short Sleeve T-Shirt (Regular and Big & Tall Sizes),4.4,,Clothing & Accessories,B06VX1N13N,Carhartt Sportswear - Mens,516
18,AHBMN64U5EZWLSWJL5ASHJL3SG5A,True,"The ""tall"" sizes are incredibly long. The regular fit is perfect.","This was a shirt for my boyfriend to wear at work in a car manufacturing plant. We ordered a ""tall"" size first and had to return it as it was way to long, even for him and he is over 6' tall. However the replacement is a perfect fit.","July 11, 2020",Amazon Customer,5.0,0,https://www.amazon.ca/gp/profile/amzn1.account.AHBMN64U5EZWLSWJL5ASHJL3SG5A/ref=cm_cr_getr_d_gw_btm?ie=UTF8,2020-09-28 19:54:54.463375,2020-09-28 19:54:54.597088,Carhartt Men's Signature Logo Short Sleeve T-Shirt (Regular and Big & Tall Sizes),4.4,,Clothing & Accessories,B06VX1N13N,Carhartt Sportswear - Mens,516
19,AHMIQUTL444ZNZBOU5PIOMKIQUFA,True,You can't go wrong with Carhartt !,"You can't go wrong with Carhartt ! Perfect stitching, thick and heavy quality cotton... A1 !","July 17, 2018",FMichaud,5.0,1,https://www.amazon.ca/gp/profile/amzn1.account.AHMIQUTL444ZNZBOU5PIOMKIQUFA/ref=cm_cr_getr_d_gw_btm?ie=UTF8,2020-09-28 19:54:54.600992,2020-09-28 19:54:54.726934,Carhartt Men's Signature Logo Short Sleeve T-Shirt (Regular and Big & Tall Sizes),4.4,,Clothing & Accessories,B06VX1N13N,Carhartt Sportswear - Mens,516
20,AHM643OJFO5U2YESG7BZRKD5BHKA,True,Awesome shirt,Great shirt. My husband loves it. Fits true to size and nice quality. Washes great.,"January 18, 2020",Lindsay F.,5.0,0,https://www.amazon.ca/gp/profile/amzn1.account.AHM643OJFO5U2YESG7BZRKD5BHKA/ref=cm_cr_getr_d_gw_btm?ie=UTF8,2020-09-28 19:54:58.839253,2020-09-28 19:54:58.964181,Carhartt Men's Signature Logo Short Sleeve T-Shirt (Regular and Big & Tall Sizes),4.4,,Clothing & Accessories,B06VX1N13N,Carhartt Sportswear - Mens,516
21,AFWY6RXFXNKVZTWX4MZAG577HRWQ,True,Fit's good and feels good,Looks nicer in person and fits better then I thought. A little loose but if it's a work shirt it'll probably be more comfy.,"January 8, 2019",TSG,5.0,0,https://www.amazon.ca/gp/profile/amzn1.account.AFWY6RXFXNKVZTWX4MZAG577HRWQ/ref=cm_cr_getr_d_gw_btm?ie=UTF8,2020-09-28 19:54:58.968085,2020-09-28 19:54:59.092037,Carhartt Men's Signature Logo Short Sleeve T-Shirt (Regular and Big & Tall Sizes),4.4,,Clothing & Accessories,B06VX1N13N,Carhartt Sportswear - Mens,516
22,AENGRVM7JK6DH4G4DJDIMP2XCMUQ,True,Great,"Great product tall is really long I should have got regular, my fault","July 30, 2020",John A. M. Smitna,5.0,0,https://www.amazon.ca/gp/profile/amzn1.account.AENGRVM7JK6DH4G4DJDIMP2XCMUQ/ref=cm_cr_getr_d_gw_btm?ie=UTF8,2020-09-28 19:54:59.095941,2020-09-28 19:54:59.219892,Carhartt Men's Signature Logo Short Sleeve T-Shirt (Regular and Big & Tall Sizes),4.4,,Clothing & Accessories,B06VX1N13N,Carhartt Sportswear - Mens,516
23,AFW2G4VWL57TSOJEAFKSKNDJNFCQ,True,My husband is a big fan of these t-shirts as ...,"My husband is a big fan of these t-shirts as the fit is generous , heavy guage material and don't shrink in length much. Recommend","July 13, 2018",VK,5.0,0,https://www.amazon.ca/gp/profile/amzn1.account.AFW2G4VWL57TSOJEAFKSKNDJNFCQ/ref=cm_cr_getr_d_gw_btm?ie=UTF8,2020-09-28 19:54:59.223797,2020-09-28 19:54:59.364340,Carhartt Men's Signature Logo Short Sleeve T-Shirt (Regular and Big & Tall Sizes),4.4,,Clothing & Accessories,B06VX1N13N,Carhartt Sportswear - Mens,516
24,AFLC5ECLEXI2ATOCWB4V45K73RYA,True,Order at least one size smaller than you normally wear,"Great shirt, should have returned it rather than trying to shrink it in the wash. These things are made big. Order at least one size smaller than you normally do.","June 2, 2020",Amazon Customer,3.0,0,https://www.amazon.ca/gp/profile/amzn1.account.AFLC5ECLEXI2ATOCWB4V45K73RYA/ref=cm_cr_getr_d_gw_btm?ie=UTF8,2020-09-28 19:54:59.369221,2020-09-28 19:54:59.499029,Carhartt Men's Signature Logo Short Sleeve T-Shirt (Regular and Big & Tall Sizes),4.4,,Clothing & Accessories,B06VX1N13N,Carhartt Sportswear - Mens,516
25,AGUIG5X6GLLE3SLSJHEUKDWMGCVQ,True,Great quality,Just like most Carhartt items very good quality thick material,"August 11, 2020",Karry,5.0,0,https://www.amazon.ca/gp/profile/amzn1.account.AGUIG5X6GLLE3SLSJHEUKDWMGCVQ/ref=cm_cr_getr_d_gw_btm?ie=UTF8,2020-09-28 19:54:59.503910,2020-09-28 19:54:59.645428,Carhartt Men's Signature Logo Short Sleeve T-Shirt (Regular and Big & Tall Sizes),4.4,,Clothing & Accessories,B06VX1N13N,Carhartt Sportswear - Mens,516
26,AHW3QEJUOZXC7GGL3YPSVILLSDNA,True,XL fits like a 2XL,My boyfriend is 260 pounds almost 6 foot tall & usually takes 2xl & ordered just that but it’s way too big on him. An XL would have been a better fit for him with probably lots of room.,"April 21, 2020",Megan,3.0,0,https://www.amazon.ca/gp/profile/amzn1.account.AHW3QEJUOZXC7GGL3YPSVILLSDNA/ref=cm_cr_getr_d_gw_btm?ie=UTF8,2020-09-28 19:54:59.649331,2020-09-28 19:54:59.808420,Carhartt Men's Signature Logo Short Sleeve T-Shirt (Regular and Big & Tall Sizes),4.4,,Clothing & Accessories,B06VX1N13N,Carhartt Sportswear - Mens,516
27,AHOGS6JMDGE7W3PV5OIC26SXNHPQ,True,Wide!,Really wide. I wasn't expecting it to be so wide. Great material and great length. I will not order again,"November 11, 2017",Kiss,2.0,1,https://www.amazon.ca/gp/profile/amzn1.account.AHOGS6JMDGE7W3PV5OIC26SXNHPQ/ref=cm_cr_getr_d_gw_btm?ie=UTF8,2020-09-28 19:54:59.814276,2020-09-28 19:54:59.959699,Carhartt Men's Signature Logo Short Sleeve T-Shirt (Regular and Big & Tall Sizes),4.4,,Clothing & Accessories,B06VX1N13N,Carhartt Sportswear - Mens,516
28,AG4HGPIS4ZJCQG2ZXDEHC6X5E6OQ,True,Great quality,Need to return for a size smaller. Large is more like an XL,"July 18, 2020",Alicia Petersen,4.0,0,https://www.amazon.ca/gp/profile/amzn1.account.AG4HGPIS4ZJCQG2ZXDEHC6X5E6OQ/ref=cm_cr_getr_d_gw_btm?ie=UTF8,2020-09-28 19:54:59.963603,2020-09-28 19:55:00.258354,Carhartt Men's Signature Logo Short Sleeve T-Shirt (Regular and Big & Tall Sizes),4.4,,Clothing & Accessories,B06VX1N13N,Carhartt Sportswear - Mens,516
29,AGSP2MO4SKMTFWNLKGYQFWD6OITA,True,Big make,"Very durable shirt, good quality. It is very big though. My husband is a large usually but he would have fit a medium.","July 25, 2020",Salome Jararuse,4.0,0,https://www.amazon.ca/gp/profile/amzn1.account.AGSP2MO4SKMTFWNLKGYQFWD6OITA/ref=cm_cr_getr_d_gw_btm?ie=UTF8,2020-09-28 19:55:00.263235,2020-09-28 19:55:00.403778,Carhartt Men's Signature Logo Short Sleeve T-Shirt (Regular and Big & Tall Sizes),4.4,,Clothing & Accessories,B06VX1N13N,Carhartt Sportswear - Mens,516
30,AFDBTFG6WQGPQDBXVXABQETKINDQ,True,Great shirt!,Amazing quality!!! Would definitely buy again and again!,"April 19, 2020",Michelle Burke,5.0,0,https://www.amazon.ca/gp/profile/amzn1.account.AFDBTFG6WQGPQDBXVXABQETKINDQ/ref=cm_cr_getr_d_gw_btm?ie=UTF8,2020-09-28 19:55:04.539081,2020-09-28 19:55:04.682552,Carhartt Men's Signature Logo Short Sleeve T-Shirt (Regular and Big & Tall Sizes),4.4,,Clothing & Accessories,B06VX1N13N,Carhartt Sportswear - Mens,516
31,AF7NTF3FZB33ZCAZUBSSH3K5ELJA,True,"Doesn't wash well, it's pilling after one wash.","I was very excited to find a shirt that would fit my husband well, however, after one wash I am disappointed with this shirt, as it's pilling. This isn't the quality we expected. It's too bad, it was a great shirt otherwise.","July 8, 2020",Jocelyn,2.0,0,https://www.amazon.ca/gp/profile/amzn1.account.AF7NTF3FZB33ZCAZUBSSH3K5ELJA/ref=cm_cr_getr_d_gw_btm?ie=UTF8,2020-09-28 19:55:04.687432,2020-09-28 19:55:04.819191,Carhartt Men's Signature Logo Short Sleeve T-Shirt (Regular and Big & Tall Sizes),4.4,,Clothing & Accessories,B06VX1N13N,Carhartt Sportswear - Mens,516
32,AG73JCVBO3B4J3IJ4OBIFC34676Q,True,Quality,"I’m a big guy 2xl and finding a shirt that fits exactly as it says it size should, is pretty hit and miss.
The fit and quality of the cotton is 10/10.
I’ll probably only buy these shirts online from here on in.","July 6, 2020",Amazon Customer,5.0,0,https://www.amazon.ca/gp/profile/amzn1.account.AG73JCVBO3B4J3IJ4OBIFC34676Q/ref=cm_cr_getr_d_gw_btm?ie=UTF8,2020-09-28 19:55:04.824072,2020-09-28 19:55:04.948023,Carhartt Men's Signature Logo Short Sleeve T-Shirt (Regular and Big & Tall Sizes),4.4,,Clothing & Accessories,B06VX1N13N,Carhartt Sportswear - Mens,516
33,AFZFK2OZMHYMLVAPWWCLWD4SK7DQ,True,"Fits big, but well made.","Fits very big, I'm 5'7, 170lbs and it's pretty big on me. Otherwise comfortable, durable material that I'm sure will hold up for a while.","September 3, 2019",Trevor Kidd,4.0,0,https://www.amazon.ca/gp/profile/amzn1.account.AFZFK2OZMHYMLVAPWWCLWD4SK7DQ/ref=cm_cr_getr_d_gw_btm?ie=UTF8,2020-09-28 19:55:04.951927,2020-09-28 19:55:05.066158,Carhartt Men's Signature Logo Short Sleeve T-Shirt (Regular and Big & Tall Sizes),4.4,,Clothing & Accessories,B06VX1N13N,Carhartt Sportswear - Mens,516
34,AHTMOYOQEHXE2FQCFT5IZZLQHGVQ,True,Good,Looks good on and is good quality,"August 2, 2020",Amazon Customer,5.0,0,https://www.amazon.ca/gp/profile/amzn1.account.AHTMOYOQEHXE2FQCFT5IZZLQHGVQ/ref=cm_cr_getr_d_gw_btm?ie=UTF8,2020-09-28 19:55:05.070061,2020-09-28 19:55:05.186205,Carhartt Men's Signature Logo Short Sleeve T-Shirt (Regular and Big & Tall Sizes),4.4,,Clothing & Accessories,B06VX1N13N,Carhartt Sportswear - Mens,516
35,AHGECGTBP6I6ITWRUCZKT7CEBEXQ,True,no back logo,First bought XL. WAY TO BIG. Then read reviews to order a medium. That was too small! Picture says it will have a logo on the back behind the neck. It did not. Completely blank on the back.,"July 9, 2020",Stacey S,3.0,0,https://www.amazon.ca/gp/profile/amzn1.account.AHGECGTBP6I6ITWRUCZKT7CEBEXQ/ref=cm_cr_getr_d_gw_btm?ie=UTF8,2020-09-28 19:55:05.190109,2020-09-28 19:55:05.314061,Carhartt Men's Signature Logo Short Sleeve T-Shirt (Regular and Big & Tall Sizes),4.4,,Clothing & Accessories,B06VX1N13N,Carhartt Sportswear - Mens,516
36,AFUF76YEVG64CWVDDMT7CCCXR3WQ,True,Great shirt,Same great quality as in stores,"January 7, 2020",Ashley,5.0,0,https://www.amazon.ca/gp/profile/amzn1.account.AFUF76YEVG64CWVDDMT7CCCXR3WQ/ref=cm_cr_getr_d_gw_btm?ie=UTF8,2020-09-28 19:55:05.318941,2020-09-28 19:55:05.433132,Carhartt Men's Signature Logo Short Sleeve T-Shirt (Regular and Big & Tall Sizes),4.4,,Clothing & Accessories,B06VX1N13N,Carhartt Sportswear - Mens,516
37,AFZUS5L27FR2QZUQZCM7O4LKVUJQ,True,Nice shirt! Awesome quality!,"If you want it to be a little more fitted, go down a size, but If you want it more loose fitting order normal size.","June 23, 2020",Harford,4.0,0,https://www.amazon.ca/gp/profile/amzn1.account.AFZUS5L27FR2QZUQZCM7O4LKVUJQ/ref=cm_cr_getr_d_gw_btm?ie=UTF8,2020-09-28 19:55:05.437040,2020-09-28 19:55:05.553179,Carhartt Men's Signature Logo Short Sleeve T-Shirt (Regular and Big & Tall Sizes),4.4,,Clothing & Accessories,B06VX1N13N,Carhartt Sportswear - Mens,516
38,AHMC2EAF3UUZINFVLHHNIFGYZNXQ,True,Great shirt,Great shirt. Tough and comfortable.,"June 3, 2020",Cobra Commander,5.0,0,https://www.amazon.ca/gp/profile/amzn1.account.AHMC2EAF3UUZINFVLHHNIFGYZNXQ/ref=cm_cr_getr_d_gw_btm?ie=UTF8,2020-09-28 19:55:05.558060,2020-09-28 19:55:05.685916,Carhartt Men's Signature Logo Short Sleeve T-Shirt (Regular and Big & Tall Sizes),4.4,,Clothing & Accessories,B06VX1N13N,Carhartt Sportswear - Mens,516
39,AGBHDBWOBUKME2SW3DHU4EAJSZSQ,True,I went back and bought more.,Perfect fit. Amazing quality as expected. I went back and bought more.,"November 12, 2018",Thomas Godfrey,5.0,0,https://www.amazon.ca/gp/profile/amzn1.account.AGBHDBWOBUKME2SW3DHU4EAJSZSQ/ref=cm_cr_getr_d_gw_btm?ie=UTF8,2020-09-28 19:55:05.690820,2020-09-28 19:55:05.809868,Carhartt Men's Signature Logo Short Sleeve T-Shirt (Regular and Big & Tall Sizes),4.4,,Clothing & Accessories,B06VX1N13N,Carhartt Sportswear - Mens,516
40,AF3EZL6SLOIYSEFMJDJBYSYDQEVA,True,Recommend,"Very comfortable, well designed, quality material. Has a loose fit, I'm 5'8"", weight 215 and I got a medium","November 23, 2019",Simon-Pierre Grenon,5.0,0,https://www.amazon.ca/gp/profile/amzn1.account.AF3EZL6SLOIYSEFMJDJBYSYDQEVA/ref=cm_cr_getr_d_gw_btm?ie=UTF8,2020-09-28 19:55:10.963610,2020-09-28 19:55:11.095342,Carhartt Men's Signature Logo Short Sleeve T-Shirt (Regular and Big & Tall Sizes),4.4,,Clothing & Accessories,B06VX1N13N,Carhartt Sportswear - Mens,516
