Unnamed: 0,author_id,verified_purchase,review_title,reviews,date,reviewer_name,ratings,people_find_helpful,reviewer_profile_url,start_time,end_time,product_name,average_rating,total_reviews,product_category,product_id,brand_name,rank
98,AGTEAYFVSXUM575YTK7LFBCXFCYQ,True,La grandeur 2x équivaut à du 3x dans les magasins,Il est parfait et assez grand pour 2x,"August 4, 2020",Stéphane Letourneau,5.0,0,https://www.amazon.ca/gp/profile/amzn1.account.AGTEAYFVSXUM575YTK7LFBCXFCYQ/ref=cm_cr_getr_d_gw_btm?ie=UTF8,2020-09-28 19:55:40.560001,2020-09-28 19:55:40.683954,Carhartt Men's Signature Logo Short Sleeve T-Shirt (Regular and Big & Tall Sizes),4.4,,Clothing & Accessories,B06VX1N13N,Carhartt Sportswear - Mens,516
99,AHERRUSQC3OTJNOTCIT24FUQK5CQ,True,"Got a medium because they said they come large but still way to big, gonna try to shrink it.",Way to big sizes not accurate,"September 9, 2020",Randy,2.0,0,https://www.amazon.ca/gp/profile/amzn1.account.AHERRUSQC3OTJNOTCIT24FUQK5CQ/ref=cm_cr_getr_d_gw_btm?ie=UTF8,2020-09-28 19:55:40.688833,2020-09-28 19:55:40.829377,Carhartt Men's Signature Logo Short Sleeve T-Shirt (Regular and Big & Tall Sizes),4.4,,Clothing & Accessories,B06VX1N13N,Carhartt Sportswear - Mens,516
100,AFQFK2KPZ43ICAIK4PYK6CEULJQQ,True,Perfect,Exactly what I wanted,"August 9, 2020",Amazon Customer,5.0,0,https://www.amazon.ca/gp/profile/amzn1.account.AFQFK2KPZ43ICAIK4PYK6CEULJQQ/ref=cm_cr_getr_d_gw_btm?ie=UTF8,2020-09-28 19:55:42.975775,2020-09-28 19:55:43.160191,Carhartt Men's Signature Logo Short Sleeve T-Shirt (Regular and Big & Tall Sizes),4.4,,Clothing & Accessories,B06VX1N13N,Carhartt Sportswear - Mens,516
101,AE3NSSVJTOORWQ6HZC7TBQIRD77Q,True,Fit good for me,It was all good,"March 2, 2020",Rick Robertson,5.0,0,https://www.amazon.ca/gp/profile/amzn1.account.AE3NSSVJTOORWQ6HZC7TBQIRD77Q/ref=cm_cr_getr_d_gw_btm?ie=UTF8,2020-09-28 19:55:43.165071,2020-09-28 19:55:43.286094,Carhartt Men's Signature Logo Short Sleeve T-Shirt (Regular and Big & Tall Sizes),4.4,,Clothing & Accessories,B06VX1N13N,Carhartt Sportswear - Mens,516
102,AEINERGDFWA5WJULP3BNI6KG5XMQ,True,Five Stars,Parfait,"September 12, 2018",Dionne Christian,5.0,0,https://www.amazon.ca/gp/profile/amzn1.account.AEINERGDFWA5WJULP3BNI6KG5XMQ/ref=cm_cr_getr_d_gw_btm?ie=UTF8,2020-09-28 19:55:43.289999,2020-09-28 19:55:43.408094,Carhartt Men's Signature Logo Short Sleeve T-Shirt (Regular and Big & Tall Sizes),4.4,,Clothing & Accessories,B06VX1N13N,Carhartt Sportswear - Mens,516
103,AHPEOZBB4FCJVDRXBBN765DIYL5Q,True,Good price,Good price,"October 12, 2018",Mitchell,5.0,0,https://www.amazon.ca/gp/profile/amzn1.account.AHPEOZBB4FCJVDRXBBN765DIYL5Q/ref=cm_cr_getr_d_gw_btm?ie=UTF8,2020-09-28 19:55:43.411998,2020-09-28 19:55:43.536927,Carhartt Men's Signature Logo Short Sleeve T-Shirt (Regular and Big & Tall Sizes),4.4,,Clothing & Accessories,B06VX1N13N,Carhartt Sportswear - Mens,516
104,AEP3KRTBANJMZIG2CVGL5HJGTZGA,True,Asked for large size which the shirt says but is ...,"Asked for large size which the shirt says but is obviously XXXL, it's a clown shirt, jokes on me, the shirt on the left is a large and the one I received is that","February 27, 2018",Lindsay Pettman,1.0,1,https://www.amazon.ca/gp/profile/amzn1.account.AEP3KRTBANJMZIG2CVGL5HJGTZGA/ref=cm_cr_getr_d_gw_btm?ie=UTF8,2020-09-28 19:55:43.546686,2020-09-28 19:55:43.664782,Carhartt Men's Signature Logo Short Sleeve T-Shirt (Regular and Big & Tall Sizes),4.4,,Clothing & Accessories,B06VX1N13N,Carhartt Sportswear - Mens,516
105,AFNEB5XLWPTPBPMJREGWP4HPWKFA,False,Good but runs big,"Bought a M and fits more like a large, good quality just runs bigger then you’d think!","December 29, 2019",Justin Hawryluk,4.0,0,https://www.amazon.ca/gp/profile/amzn1.account.AFNEB5XLWPTPBPMJREGWP4HPWKFA/ref=cm_cr_getr_d_gw_btm?ie=UTF8,2020-09-28 19:55:43.668686,2020-09-28 19:55:43.782878,Carhartt Men's Signature Logo Short Sleeve T-Shirt (Regular and Big & Tall Sizes),4.4,,Clothing & Accessories,B06VX1N13N,Carhartt Sportswear - Mens,516
106,AHXDVUFJHEY7XY4VOCXHYU42IVKQ,True,"Great price, quality",Great quality,"August 11, 2019",Jamie Lynch,5.0,0,https://www.amazon.ca/gp/profile/amzn1.account.AHXDVUFJHEY7XY4VOCXHYU42IVKQ/ref=cm_cr_getr_d_gw_btm?ie=UTF8,2020-09-28 19:55:43.786782,2020-09-28 19:55:43.905853,Carhartt Men's Signature Logo Short Sleeve T-Shirt (Regular and Big & Tall Sizes),4.4,,Clothing & Accessories,B06VX1N13N,Carhartt Sportswear - Mens,516
