Unnamed: 0,author_id,verified_purchase,review_title,reviews,date,reviewer_name,ratings,people_find_helpful,reviewer_profile_url,start_time,end_time,product_name,average_rating,total_reviews,product_category,product_id,brand_name,rank
197,AEL3NLT5M2GSBF74A2BYHCRCSMGQ,True,Good,"Slightly thicker than i thought.
Good for the price","June 15, 2019",J,5.0,0,https://www.amazon.ca/gp/profile/amzn1.account.AEL3NLT5M2GSBF74A2BYHCRCSMGQ/ref=cm_cr_getr_d_gw_btm?ie=UTF8,2020-09-28 17:15:50.021588,2020-09-28 17:15:50.164810,"Gildan Mens Ultra Cotton Adult Long Sleeve T-Shirt, 2-Pack T-Shirt",4.3,,Clothing & Accessories,B07683LBDF,No,38
198,AG7ULRNG2YUBQRNKV3OLOHYQFNBA,True,Good,Good,"June 28, 2020",Amazon Customer,4.0,0,https://www.amazon.ca/gp/profile/amzn1.account.AG7ULRNG2YUBQRNKV3OLOHYQFNBA/ref=cm_cr_getr_d_gw_btm?ie=UTF8,2020-09-28 17:15:50.169722,2020-09-28 17:15:50.314676,"Gildan Mens Ultra Cotton Adult Long Sleeve T-Shirt, 2-Pack T-Shirt",4.3,,Clothing & Accessories,B07683LBDF,No,38
199,AHMXM2O3XIU3JMFL2HXR5QZSREJQ,True,Warm and fits well,"Love, looks good work with jeans or trousers, warm","October 18, 2019",Aimalohi U.,4.0,0,https://www.amazon.ca/gp/profile/amzn1.account.AHMXM2O3XIU3JMFL2HXR5QZSREJQ/ref=cm_cr_getr_d_gw_btm?ie=UTF8,2020-09-28 17:15:50.321539,2020-09-28 17:15:50.475280,"Gildan Mens Ultra Cotton Adult Long Sleeve T-Shirt, 2-Pack T-Shirt",4.3,,Clothing & Accessories,B07683LBDF,No,38
200,AFCIHY72LDN6LJJVHLASZPPFCDJQ,True,Shrinks,Shrinks really bad after first wash even when instructions followed,"January 19, 2020",michelle,1.0,0,https://www.amazon.ca/gp/profile/amzn1.account.AFCIHY72LDN6LJJVHLASZPPFCDJQ/ref=cm_cr_getr_d_gw_btm?ie=UTF8,2020-09-28 17:15:54.662735,2020-09-28 17:15:54.829213,"Gildan Mens Ultra Cotton Adult Long Sleeve T-Shirt, 2-Pack T-Shirt",4.3,,Clothing & Accessories,B07683LBDF,No,38
201,AFRNQI3GTCWIKT6AONQOWCWDJUEA,True,Great purchase,Material is good quality,"February 18, 2020",HARSH SINGH,5.0,0,https://www.amazon.ca/gp/profile/amzn1.account.AFRNQI3GTCWIKT6AONQOWCWDJUEA/ref=cm_cr_getr_d_gw_btm?ie=UTF8,2020-09-28 17:15:54.834094,2020-09-28 17:15:54.986350,"Gildan Mens Ultra Cotton Adult Long Sleeve T-Shirt, 2-Pack T-Shirt",4.3,,Clothing & Accessories,B07683LBDF,No,38
202,AFJSKMLLOATBUFQ4D5AGFRA5RSLQ,True,My brother in law liked it,Purchased ac a gift,"February 28, 2020",Amazon Customer,5.0,0,https://www.amazon.ca/gp/profile/amzn1.account.AFJSKMLLOATBUFQ4D5AGFRA5RSLQ/ref=cm_cr_getr_d_gw_btm?ie=UTF8,2020-09-28 17:15:54.992206,2020-09-28 17:15:55.146520,"Gildan Mens Ultra Cotton Adult Long Sleeve T-Shirt, 2-Pack T-Shirt",4.3,,Clothing & Accessories,B07683LBDF,No,38
203,AEVNMEMGIGQEQ2IQSCTBUGJO4FZQ,True,BEST,amazon i love you,"March 12, 2020",Bflow,5.0,0,https://www.amazon.ca/gp/profile/amzn1.account.AEVNMEMGIGQEQ2IQSCTBUGJO4FZQ/ref=cm_cr_getr_d_gw_btm?ie=UTF8,2020-09-28 17:15:55.152329,2020-09-28 17:15:55.327283,"Gildan Mens Ultra Cotton Adult Long Sleeve T-Shirt, 2-Pack T-Shirt",4.3,,Clothing & Accessories,B07683LBDF,No,38
204,AHQHO5QXSRFYEFDTZPXSBCRC6BIA,True,Nice feel,Fits well,"May 12, 2020",Victor Chow,5.0,0,https://www.amazon.ca/gp/profile/amzn1.account.AHQHO5QXSRFYEFDTZPXSBCRC6BIA/ref=cm_cr_getr_d_gw_btm?ie=UTF8,2020-09-28 17:15:55.335077,2020-09-28 17:15:55.499946,"Gildan Mens Ultra Cotton Adult Long Sleeve T-Shirt, 2-Pack T-Shirt",4.3,,Clothing & Accessories,B07683LBDF,No,38
205,AH2DCLL4TEHB7O35FO52HRHKF6DQ,True,Good quality,"Great quality, great value","January 1, 2020",Wizkiddwpg,5.0,0,https://www.amazon.ca/gp/profile/amzn1.account.AH2DCLL4TEHB7O35FO52HRHKF6DQ/ref=cm_cr_getr_d_gw_btm?ie=UTF8,2020-09-28 17:15:55.504826,2020-09-28 17:15:55.691242,"Gildan Mens Ultra Cotton Adult Long Sleeve T-Shirt, 2-Pack T-Shirt",4.3,,Clothing & Accessories,B07683LBDF,No,38
206,AGC2264ALZZ32VBF24WJPI4A2CRA,True,Qualité au rv,"Très confo, cotton épais, très bien","November 1, 2019",Louis R.,5.0,0,https://www.amazon.ca/gp/profile/amzn1.account.AGC2264ALZZ32VBF24WJPI4A2CRA/ref=cm_cr_getr_d_gw_btm?ie=UTF8,2020-09-28 17:15:55.697097,2020-09-28 17:15:55.909213,"Gildan Mens Ultra Cotton Adult Long Sleeve T-Shirt, 2-Pack T-Shirt",4.3,,Clothing & Accessories,B07683LBDF,No,38
207,AHTCZMX26SEZJWMVBN27IK2LB6TA,True,Great buy!,My husband loves these shirts. Excellent quality and wear for the price.,"January 4, 2019",Sofie's mom,5.0,0,https://www.amazon.ca/gp/profile/amzn1.account.AHTCZMX26SEZJWMVBN27IK2LB6TA/ref=cm_cr_getr_d_gw_btm?ie=UTF8,2020-09-28 17:15:55.916045,2020-09-28 17:15:56.088227,"Gildan Mens Ultra Cotton Adult Long Sleeve T-Shirt, 2-Pack T-Shirt",4.3,,Clothing & Accessories,B07683LBDF,No,38
208,AHSK5KWBPL2Z4DFCAKE7NBEINVDQ,True,Nice,Fitted them just right!,"January 24, 2020",Kimmy F,5.0,0,https://www.amazon.ca/gp/profile/amzn1.account.AHSK5KWBPL2Z4DFCAKE7NBEINVDQ/ref=cm_cr_getr_d_gw_btm?ie=UTF8,2020-09-28 17:15:56.094084,2020-09-28 17:15:56.327037,"Gildan Mens Ultra Cotton Adult Long Sleeve T-Shirt, 2-Pack T-Shirt",4.3,,Clothing & Accessories,B07683LBDF,No,38
209,AEAFZQWNYHQ4ISPML5W46LNCQHIQ,True,Worth the price,Work well for what I use it for,"November 10, 2019",mahendra,5.0,0,https://www.amazon.ca/gp/profile/amzn1.account.AEAFZQWNYHQ4ISPML5W46LNCQHIQ/ref=cm_cr_getr_d_gw_btm?ie=UTF8,2020-09-28 17:15:56.333061,2020-09-28 17:15:56.593446,"Gildan Mens Ultra Cotton Adult Long Sleeve T-Shirt, 2-Pack T-Shirt",4.3,,Clothing & Accessories,B07683LBDF,No,38
210,AGFUBHNV3VGG5KAK42ZV4XFRU2QA,True,Very good quality.,"Fits great a little loose the way I like. Heavy duty cotton, for cooler weather. Excellent price, will definitely but again.","August 5, 2020",lauralee jarvis,5.0,0,https://www.amazon.ca/gp/profile/amzn1.account.AGFUBHNV3VGG5KAK42ZV4XFRU2QA/ref=cm_cr_getr_d_gw_btm?ie=UTF8,2020-09-28 17:15:59.811941,2020-09-28 17:16:00.102909,"Gildan Mens Ultra Cotton Adult Long Sleeve T-Shirt, 2-Pack T-Shirt",4.3,,Clothing & Accessories,B07683LBDF,No,38
211,AFF27B66FQVROY67JLQZOTMD2QPQ,True,Would recommend,Love these long sleeve t’shirts,"November 2, 2019",Patrice,5.0,0,https://www.amazon.ca/gp/profile/amzn1.account.AFF27B66FQVROY67JLQZOTMD2QPQ/ref=cm_cr_getr_d_gw_btm?ie=UTF8,2020-09-28 17:16:00.107788,2020-09-28 17:16:00.258120,"Gildan Mens Ultra Cotton Adult Long Sleeve T-Shirt, 2-Pack T-Shirt",4.3,,Clothing & Accessories,B07683LBDF,No,38
212,AF43GW5IHWUYAVZCRUL6VOKHG32A,True,Good quality and fit but color is slightly off,Red shirt was more like a fire truck red than the wine color in the photos.,"November 16, 2018",James,3.0,0,https://www.amazon.ca/gp/profile/amzn1.account.AF43GW5IHWUYAVZCRUL6VOKHG32A/ref=cm_cr_getr_d_gw_btm?ie=UTF8,2020-09-28 17:16:00.264924,2020-09-28 17:16:00.406803,"Gildan Mens Ultra Cotton Adult Long Sleeve T-Shirt, 2-Pack T-Shirt",4.3,,Clothing & Accessories,B07683LBDF,No,38
213,AGVMPTL7TW6OIVMRTUFVG7DCGRHA,True,DO NOT BUY,"Shirts are of extremely low quality, stitching cuffs ripped after one wash.","February 9, 2020",muneeb munawar,1.0,1,https://www.amazon.ca/gp/profile/amzn1.account.AGVMPTL7TW6OIVMRTUFVG7DCGRHA/ref=cm_cr_getr_d_gw_btm?ie=UTF8,2020-09-28 17:16:00.411684,2020-09-28 17:16:00.639521,"Gildan Mens Ultra Cotton Adult Long Sleeve T-Shirt, 2-Pack T-Shirt",4.3,,Clothing & Accessories,B07683LBDF,No,38
214,AHYUIODJMHVJ3VE2HPAVGU4EBJ7Q,True,value,great value i would buy this again,"December 2, 2019",OhlookaCandy,5.0,0,https://www.amazon.ca/gp/profile/amzn1.account.AHYUIODJMHVJ3VE2HPAVGU4EBJ7Q/ref=cm_cr_getr_d_gw_btm?ie=UTF8,2020-09-28 17:16:00.644401,2020-09-28 17:16:00.824163,"Gildan Mens Ultra Cotton Adult Long Sleeve T-Shirt, 2-Pack T-Shirt",4.3,,Clothing & Accessories,B07683LBDF,No,38
215,AFSXDUXS3NRE3SEWEA6EBBW2TLYQ,True,Good value.,Very Happy.,"July 9, 2020",Cynthia Buttrey,5.0,0,https://www.amazon.ca/gp/profile/amzn1.account.AFSXDUXS3NRE3SEWEA6EBBW2TLYQ/ref=cm_cr_getr_d_gw_btm?ie=UTF8,2020-09-28 17:16:00.830020,2020-09-28 17:16:00.998961,"Gildan Mens Ultra Cotton Adult Long Sleeve T-Shirt, 2-Pack T-Shirt",4.3,,Clothing & Accessories,B07683LBDF,No,38
216,AEB2WAMUXKFXGTCVEEVFX2F5IUCQ,True,As advertised,Comfortable,"March 8, 2020",Robert Willits,4.0,0,https://www.amazon.ca/gp/profile/amzn1.account.AEB2WAMUXKFXGTCVEEVFX2F5IUCQ/ref=cm_cr_getr_d_gw_btm?ie=UTF8,2020-09-28 17:16:01.004842,2020-09-28 17:16:01.193360,"Gildan Mens Ultra Cotton Adult Long Sleeve T-Shirt, 2-Pack T-Shirt",4.3,,Clothing & Accessories,B07683LBDF,No,38
217,AFQKMFAPW64UYXGS7THKLCSUN6MQ,True,Fits small,Therefore useless.,"March 5, 2020",fleda,2.0,0,https://www.amazon.ca/gp/profile/amzn1.account.AFQKMFAPW64UYXGS7THKLCSUN6MQ/ref=cm_cr_getr_d_gw_btm?ie=UTF8,2020-09-28 17:16:01.198662,2020-09-28 17:16:01.404402,"Gildan Mens Ultra Cotton Adult Long Sleeve T-Shirt, 2-Pack T-Shirt",4.3,,Clothing & Accessories,B07683LBDF,No,38
218,AFQSL2OVADRGYNWCYLE6HTLQ4DHA,True,"Nice,light shirts","Good product at a reasonable price. Fast shipping, arrived a week before scheduled time.","July 7, 2018",Amazon Customer,4.0,0,https://www.amazon.ca/gp/profile/amzn1.account.AFQSL2OVADRGYNWCYLE6HTLQ4DHA/ref=cm_cr_getr_d_gw_btm?ie=UTF8,2020-09-28 17:16:01.410258,2020-09-28 17:16:01.597232,"Gildan Mens Ultra Cotton Adult Long Sleeve T-Shirt, 2-Pack T-Shirt",4.3,,Clothing & Accessories,B07683LBDF,No,38
219,AGBIZ5ICJ4SODJR4O3VKJWKEFYAA,True,Worth it,"Amazing quality and they look great, I'll be buying more after I end up ruining these lol","June 20, 2018",Steve,5.0,0,https://www.amazon.ca/gp/profile/amzn1.account.AGBIZ5ICJ4SODJR4O3VKJWKEFYAA/ref=cm_cr_getr_d_gw_btm?ie=UTF8,2020-09-28 17:16:01.603089,2020-09-28 17:16:01.798287,"Gildan Mens Ultra Cotton Adult Long Sleeve T-Shirt, 2-Pack T-Shirt",4.3,,Clothing & Accessories,B07683LBDF,No,38
220,AENEK7OYDDGHK35LMTU2X4NTEUFQ,True,Four Stars,Your sizes are at least 1 size bigger then Canadian sizes,"June 14, 2018",Pete  Sly,4.0,1,https://www.amazon.ca/gp/profile/amzn1.account.AENEK7OYDDGHK35LMTU2X4NTEUFQ/ref=cm_cr_getr_d_gw_btm?ie=UTF8,2020-09-28 17:16:04.052429,2020-09-28 17:16:04.246029,"Gildan Mens Ultra Cotton Adult Long Sleeve T-Shirt, 2-Pack T-Shirt",4.3,,Clothing & Accessories,B07683LBDF,No,38
221,AGQK32FY65NNUCJFQ3APCINSMNYQ,True,VERY ROUGH COTTON ALMOST JUTE LIKE,SEE ABOVE,"July 16, 2020",Amazon Customer,3.0,0,https://www.amazon.ca/gp/profile/amzn1.account.AGQK32FY65NNUCJFQ3APCINSMNYQ/ref=cm_cr_getr_d_gw_btm?ie=UTF8,2020-09-28 17:16:04.252866,2020-09-28 17:16:04.446763,"Gildan Mens Ultra Cotton Adult Long Sleeve T-Shirt, 2-Pack T-Shirt",4.3,,Clothing & Accessories,B07683LBDF,No,38
222,AHEL2GGZQEWJEFLDAV55MJYTPQ7A,True,T-shirt,Parfait merci,"March 5, 2020",Charles Germain,5.0,0,https://www.amazon.ca/gp/profile/amzn1.account.AHEL2GGZQEWJEFLDAV55MJYTPQ7A/ref=cm_cr_getr_d_gw_btm?ie=UTF8,2020-09-28 17:16:04.453498,2020-09-28 17:16:04.637961,"Gildan Mens Ultra Cotton Adult Long Sleeve T-Shirt, 2-Pack T-Shirt",4.3,,Clothing & Accessories,B07683LBDF,No,38
223,AFJIGFHSYQKELQVCPKWOQWIMWCLA,True,Pretty good deal,"I bought these for work shirts, and they are affordable and good.","December 20, 2018",T.C.,4.0,0,https://www.amazon.ca/gp/profile/amzn1.account.AFJIGFHSYQKELQVCPKWOQWIMWCLA/ref=cm_cr_getr_d_gw_btm?ie=UTF8,2020-09-28 17:16:04.642841,2020-09-28 17:16:04.807838,"Gildan Mens Ultra Cotton Adult Long Sleeve T-Shirt, 2-Pack T-Shirt",4.3,,Clothing & Accessories,B07683LBDF,No,38
224,AGWWVLUVNY7RLXXNN3KJ6OCSM4YQ,True,perfect - love these,"love these - wish they were a bit longer in an XLT but being 6'4"" that's what you get...will order again...","May 20, 2020",Amazon Customer,5.0,0,https://www.amazon.ca/gp/profile/amzn1.account.AGWWVLUVNY7RLXXNN3KJ6OCSM4YQ/ref=cm_cr_getr_d_gw_btm?ie=UTF8,2020-09-28 17:16:04.812691,2020-09-28 17:16:04.978610,"Gildan Mens Ultra Cotton Adult Long Sleeve T-Shirt, 2-Pack T-Shirt",4.3,,Clothing & Accessories,B07683LBDF,No,38
225,AHAUQ5JB62DKHDO4YBEXMMQ2B3HA,True,Good quality,I will be ordering another color. Really good and the price is excellent.,"October 12, 2018",One Stop shopping,5.0,0,https://www.amazon.ca/gp/profile/amzn1.account.AHAUQ5JB62DKHDO4YBEXMMQ2B3HA/ref=cm_cr_getr_d_gw_btm?ie=UTF8,2020-09-28 17:16:04.984466,2020-09-28 17:16:05.135316,"Gildan Mens Ultra Cotton Adult Long Sleeve T-Shirt, 2-Pack T-Shirt",4.3,,Clothing & Accessories,B07683LBDF,No,38
226,AHIFWW7JIYE5K63A2DWZPRS342QQ,True,I like it,Been using it for 4 months. Never shrink on me,"July 31, 2019",Jeffrey,5.0,0,https://www.amazon.ca/gp/profile/amzn1.account.AHIFWW7JIYE5K63A2DWZPRS342QQ/ref=cm_cr_getr_d_gw_btm?ie=UTF8,2020-09-28 17:16:05.140197,2020-09-28 17:16:05.293060,"Gildan Mens Ultra Cotton Adult Long Sleeve T-Shirt, 2-Pack T-Shirt",4.3,,Clothing & Accessories,B07683LBDF,No,38
227,AHXQWI2IJUSO4U33SJI36DCRXV4A,True,It's itchy.,"It's itchy.
But it fits just right.","October 29, 2019",John Paul Olino,3.0,0,https://www.amazon.ca/gp/profile/amzn1.account.AHXQWI2IJUSO4U33SJI36DCRXV4A/ref=cm_cr_getr_d_gw_btm?ie=UTF8,2020-09-28 17:16:05.298090,2020-09-28 17:16:05.439491,"Gildan Mens Ultra Cotton Adult Long Sleeve T-Shirt, 2-Pack T-Shirt",4.3,,Clothing & Accessories,B07683LBDF,No,38
228,AEFHNPJ6BIUPDJIF3F7AS55HE65A,True,Good Buy,"As expected , good deal","December 17, 2019",Amazon Customer,5.0,0,https://www.amazon.ca/gp/profile/amzn1.account.AEFHNPJ6BIUPDJIF3F7AS55HE65A/ref=cm_cr_getr_d_gw_btm?ie=UTF8,2020-09-28 17:16:05.444371,2020-09-28 17:16:05.596246,"Gildan Mens Ultra Cotton Adult Long Sleeve T-Shirt, 2-Pack T-Shirt",4.3,,Clothing & Accessories,B07683LBDF,No,38
229,AEGHX5SSFEA3JHQQMBV2M3CEXDYA,True,Great fit,Fits correctly and feels nice. Would purchase this product again.,"June 21, 2019",PJS,4.0,0,https://www.amazon.ca/gp/profile/amzn1.account.AEGHX5SSFEA3JHQQMBV2M3CEXDYA/ref=cm_cr_getr_d_gw_btm?ie=UTF8,2020-09-28 17:16:05.602076,2020-09-28 17:16:05.745933,"Gildan Mens Ultra Cotton Adult Long Sleeve T-Shirt, 2-Pack T-Shirt",4.3,,Clothing & Accessories,B07683LBDF,No,38
230,AHA6WLJFK4C7LSUSQX76PUTYSEMQ,True,Good shirt,Got this as an undershirt for my work uniform and it fits comfortably and it looks professional under my work t-shirt,"January 10, 2020",Jean-Luc,5.0,0,https://www.amazon.ca/gp/profile/amzn1.account.AHA6WLJFK4C7LSUSQX76PUTYSEMQ/ref=cm_cr_getr_d_gw_btm?ie=UTF8,2020-09-28 17:16:08.913467,2020-09-28 17:16:09.156621,"Gildan Mens Ultra Cotton Adult Long Sleeve T-Shirt, 2-Pack T-Shirt",4.3,,Clothing & Accessories,B07683LBDF,No,38
231,AFAT5T37AUCCSBKI5MWVDKE5KEYA,True,Super happy,I always buy the t shirts at my local michaels because they’re my favourite shirts so when I saw they made long sleeves I absolutely had to buy them and they did not disappoint,"January 8, 2020",FB,5.0,0,https://www.amazon.ca/gp/profile/amzn1.account.AFAT5T37AUCCSBKI5MWVDKE5KEYA/ref=cm_cr_getr_d_gw_btm?ie=UTF8,2020-09-28 17:16:09.166427,2020-09-28 17:16:09.434195,"Gildan Mens Ultra Cotton Adult Long Sleeve T-Shirt, 2-Pack T-Shirt",4.3,,Clothing & Accessories,B07683LBDF,No,38
232,AF677EX43BNPMGW4MZL5CDSZDK2Q,True,Great t shirt !,Great t shirt!,"February 5, 2020",Bill,5.0,0,https://www.amazon.ca/gp/profile/amzn1.account.AF677EX43BNPMGW4MZL5CDSZDK2Q/ref=cm_cr_getr_d_gw_btm?ie=UTF8,2020-09-28 17:16:09.443954,2020-09-28 17:16:09.708535,"Gildan Mens Ultra Cotton Adult Long Sleeve T-Shirt, 2-Pack T-Shirt",4.3,,Clothing & Accessories,B07683LBDF,No,38
233,AEUT6WVXZUKK3IUMAZ3JN2OICNUQ,True,Very cheap feeling facbric,Fabric was cheap and crunchy to touch,"March 9, 2020",Amazon Customer,1.0,0,https://www.amazon.ca/gp/profile/amzn1.account.AEUT6WVXZUKK3IUMAZ3JN2OICNUQ/ref=cm_cr_getr_d_gw_btm?ie=UTF8,2020-09-28 17:16:09.718256,2020-09-28 17:16:09.976934,"Gildan Mens Ultra Cotton Adult Long Sleeve T-Shirt, 2-Pack T-Shirt",4.3,,Clothing & Accessories,B07683LBDF,No,38
234,AHPXW2QBY2PNCSKH7PV7SCZZKY6Q,True,Great fit and value.,I buy the 2xl for the length of my Adonis like torso. These fit very well and are of excellent quality. Great value.,"August 17, 2018",Doug D.,5.0,1,https://www.amazon.ca/gp/profile/amzn1.account.AHPXW2QBY2PNCSKH7PV7SCZZKY6Q/ref=cm_cr_getr_d_gw_btm?ie=UTF8,2020-09-28 17:16:09.982767,2020-09-28 17:16:10.155153,"Gildan Mens Ultra Cotton Adult Long Sleeve T-Shirt, 2-Pack T-Shirt",4.3,,Clothing & Accessories,B07683LBDF,No,38
235,AHVL74IX3UP6MMMUJK4EUQVKFGCA,True,I appreciate things that look exactly like the photo like these,I’m 130 pounds and then mediums fit just perfectly,"April 24, 2019",NicoleVictoia,5.0,0,https://www.amazon.ca/gp/profile/amzn1.account.AHVL74IX3UP6MMMUJK4EUQVKFGCA/ref=cm_cr_getr_d_gw_btm?ie=UTF8,2020-09-28 17:16:10.160034,2020-09-28 17:16:10.328472,"Gildan Mens Ultra Cotton Adult Long Sleeve T-Shirt, 2-Pack T-Shirt",4.3,,Clothing & Accessories,B07683LBDF,No,38
236,AGTQYXQCUU4AMXPRD5YPS52ZU27A,True,ok,ok,"January 14, 2019",Steve Smukavic,2.0,1,https://www.amazon.ca/gp/profile/amzn1.account.AGTQYXQCUU4AMXPRD5YPS52ZU27A/ref=cm_cr_getr_d_gw_btm?ie=UTF8,2020-09-28 17:16:10.334330,2020-09-28 17:16:10.495773,"Gildan Mens Ultra Cotton Adult Long Sleeve T-Shirt, 2-Pack T-Shirt",4.3,,Clothing & Accessories,B07683LBDF,No,38
237,AFW57TKQFBITQJW3JXPV7UWYCVIQ,True,Little small,Tend to b little on the small side,"October 28, 2019",Shannon,3.0,0,https://www.amazon.ca/gp/profile/amzn1.account.AFW57TKQFBITQJW3JXPV7UWYCVIQ/ref=cm_cr_getr_d_gw_btm?ie=UTF8,2020-09-28 17:16:10.500652,2020-09-28 17:16:10.654914,"Gildan Mens Ultra Cotton Adult Long Sleeve T-Shirt, 2-Pack T-Shirt",4.3,,Clothing & Accessories,B07683LBDF,No,38
238,AGP5PNSBOGAIVGZNCFVOE6W2UB7A,True,I would buy again,Fits well comfortable,"October 29, 2019",Andy zuff,4.0,0,https://www.amazon.ca/gp/profile/amzn1.account.AGP5PNSBOGAIVGZNCFVOE6W2UB7A/ref=cm_cr_getr_d_gw_btm?ie=UTF8,2020-09-28 17:16:10.659794,2020-09-28 17:16:10.821919,"Gildan Mens Ultra Cotton Adult Long Sleeve T-Shirt, 2-Pack T-Shirt",4.3,,Clothing & Accessories,B07683LBDF,No,38
239,AEQ3QWHMYBQKMM67XXJW2GJWWFNA,True,Comfortable,Comfortable,"April 2, 2020",Rich,5.0,0,https://www.amazon.ca/gp/profile/amzn1.account.AEQ3QWHMYBQKMM67XXJW2GJWWFNA/ref=cm_cr_getr_d_gw_btm?ie=UTF8,2020-09-28 17:16:10.826768,2020-09-28 17:16:10.997645,"Gildan Mens Ultra Cotton Adult Long Sleeve T-Shirt, 2-Pack T-Shirt",4.3,,Clothing & Accessories,B07683LBDF,No,38
240,AG5P3KEWTXGP635MHYM5BBYHK5KA,True,QUALITY AT ITS BEST,SO VERY COMFORTABLE. WILL BUY MORE,"January 30, 2020",The Time Boutique Shop,5.0,0,https://www.amazon.ca/gp/profile/amzn1.account.AG5P3KEWTXGP635MHYM5BBYHK5KA/ref=cm_cr_getr_d_gw_btm?ie=UTF8,2020-09-28 17:16:15.130377,2020-09-28 17:16:15.316791,"Gildan Mens Ultra Cotton Adult Long Sleeve T-Shirt, 2-Pack T-Shirt",4.3,,Clothing & Accessories,B07683LBDF,No,38
241,AEYEEQCH3GIN4PJCMQADES5KNPCA,True,Good product,"I like the product, good value","August 10, 2019",Stephen W,5.0,0,https://www.amazon.ca/gp/profile/amzn1.account.AEYEEQCH3GIN4PJCMQADES5KNPCA/ref=cm_cr_getr_d_gw_btm?ie=UTF8,2020-09-28 17:16:15.321672,2020-09-28 17:16:15.483695,"Gildan Mens Ultra Cotton Adult Long Sleeve T-Shirt, 2-Pack T-Shirt",4.3,,Clothing & Accessories,B07683LBDF,No,38
242,AFZOPEEKHMB66CMUSZINBNJ6XNHA,True,Price can't be beat,Practical long sleeve shirts at an amazing price.,"March 9, 2019",Unknown,5.0,0,https://www.amazon.ca/gp/profile/amzn1.account.AFZOPEEKHMB66CMUSZINBNJ6XNHA/ref=cm_cr_getr_d_gw_btm?ie=UTF8,2020-09-28 17:16:15.489552,2020-09-28 17:16:15.634023,"Gildan Mens Ultra Cotton Adult Long Sleeve T-Shirt, 2-Pack T-Shirt",4.3,,Clothing & Accessories,B07683LBDF,No,38
243,AGINJ77Y5SNGTPCZQ4BZ4CL2KN3Q,True,Excellent product,Excellent product,"November 13, 2019",Jeannette,5.0,0,https://www.amazon.ca/gp/profile/amzn1.account.AGINJ77Y5SNGTPCZQ4BZ4CL2KN3Q/ref=cm_cr_getr_d_gw_btm?ie=UTF8,2020-09-28 17:16:15.638902,2020-09-28 17:16:15.788571,"Gildan Mens Ultra Cotton Adult Long Sleeve T-Shirt, 2-Pack T-Shirt",4.3,,Clothing & Accessories,B07683LBDF,No,38
244,AFJO3APQJAA7UFLOTZE2X665CJUQ,True,Perfect!,"Very good quality. I washed and dried them in the drier and yes they do shrink. I got size large because I knew they would shrink, so if you are putting this in the dryer then expect shrinkage","August 11, 2018",Carl Green,5.0,0,https://www.amazon.ca/gp/profile/amzn1.account.AFJO3APQJAA7UFLOTZE2X665CJUQ/ref=cm_cr_getr_d_gw_btm?ie=UTF8,2020-09-28 17:16:15.793451,2020-09-28 17:16:15.956412,"Gildan Mens Ultra Cotton Adult Long Sleeve T-Shirt, 2-Pack T-Shirt",4.3,,Clothing & Accessories,B07683LBDF,No,38
245,AE57HU2AZSTTX4JJZGGNNRMDYD6Q,True,Trop mince,Trop mince,"December 25, 2019",Client d'Amazon,3.0,0,https://www.amazon.ca/gp/profile/amzn1.account.AE57HU2AZSTTX4JJZGGNNRMDYD6Q/ref=cm_cr_getr_d_gw_btm?ie=UTF8,2020-09-28 17:16:15.969106,2020-09-28 17:16:16.136978,"Gildan Mens Ultra Cotton Adult Long Sleeve T-Shirt, 2-Pack T-Shirt",4.3,,Clothing & Accessories,B07683LBDF,No,38
246,AFY4JCLCJQZU2STJW4VR2WC3SKDA,True,Just as discribed,Nice shirts great fit. Material very comfortable.,"February 21, 2019",Amazon Customer,5.0,0,https://www.amazon.ca/gp/profile/amzn1.account.AFY4JCLCJQZU2STJW4VR2WC3SKDA/ref=cm_cr_getr_d_gw_btm?ie=UTF8,2020-09-28 17:16:16.142833,2020-09-28 17:16:16.298993,"Gildan Mens Ultra Cotton Adult Long Sleeve T-Shirt, 2-Pack T-Shirt",4.3,,Clothing & Accessories,B07683LBDF,No,38
247,AEI444AH72WJMWFQDMMW4JOOEYTQ,True,They fit great,Fits great,"January 22, 2020",kevin carman,5.0,0,https://www.amazon.ca/gp/profile/amzn1.account.AEI444AH72WJMWFQDMMW4JOOEYTQ/ref=cm_cr_getr_d_gw_btm?ie=UTF8,2020-09-28 17:16:16.303878,2020-09-28 17:16:16.460707,"Gildan Mens Ultra Cotton Adult Long Sleeve T-Shirt, 2-Pack T-Shirt",4.3,,Clothing & Accessories,B07683LBDF,No,38
248,AFHSGCQVWQHJON3GQVPV6JN775QQ,True,Likes them better than Carhardts.,Good,"April 25, 2020",Amazon Customer,4.0,0,https://www.amazon.ca/gp/profile/amzn1.account.AFHSGCQVWQHJON3GQVPV6JN775QQ/ref=cm_cr_getr_d_gw_btm?ie=UTF8,2020-09-28 17:16:16.466562,2020-09-28 17:16:16.631193,"Gildan Mens Ultra Cotton Adult Long Sleeve T-Shirt, 2-Pack T-Shirt",4.3,,Clothing & Accessories,B07683LBDF,No,38
249,AHVJYVIG7SAKRDBGDJMG2ZU4LBEQ,True,I feel the knowledge that you can trust your shipper....Quality is No !,Nothing to dislike,"November 30, 2019",Bucky in Belleville,5.0,0,https://www.amazon.ca/gp/profile/amzn1.account.AHVJYVIG7SAKRDBGDJMG2ZU4LBEQ/ref=cm_cr_getr_d_gw_btm?ie=UTF8,2020-09-28 17:16:16.638025,2020-09-28 17:16:16.827431,"Gildan Mens Ultra Cotton Adult Long Sleeve T-Shirt, 2-Pack T-Shirt",4.3,,Clothing & Accessories,B07683LBDF,No,38
250,AGQQ45LSICE5BABTRMW3OV3LVR7Q,True,good work shirts,"Good, cheap work shirts. They do shrink a bit though. For the price, I can't complain.","January 16, 2019",J Beau,5.0,0,https://www.amazon.ca/gp/profile/amzn1.account.AGQQ45LSICE5BABTRMW3OV3LVR7Q/ref=cm_cr_getr_d_gw_btm?ie=UTF8,2020-09-28 17:16:20.012477,2020-09-28 17:16:20.273403,"Gildan Mens Ultra Cotton Adult Long Sleeve T-Shirt, 2-Pack T-Shirt",4.3,,Clothing & Accessories,B07683LBDF,No,38
251,AHTG2M5KLRQYPMNAJVCZ2ME5YL5Q,True,Long sleeve shirt,Perfect,"July 16, 2020",Pw,5.0,0,https://www.amazon.ca/gp/profile/amzn1.account.AHTG2M5KLRQYPMNAJVCZ2ME5YL5Q/ref=cm_cr_getr_d_gw_btm?ie=UTF8,2020-09-28 17:16:20.281739,2020-09-28 17:16:20.555161,"Gildan Mens Ultra Cotton Adult Long Sleeve T-Shirt, 2-Pack T-Shirt",4.3,,Clothing & Accessories,B07683LBDF,No,38
252,AHS2OH56IRHZECUTTDQLKJ5FVOYA,True,"Would recommend This product, probably will buy more in a different colour myself.",Come in lots of colours and they fit well.,"April 11, 2019",Pj,4.0,0,https://www.amazon.ca/gp/profile/amzn1.account.AHS2OH56IRHZECUTTDQLKJ5FVOYA/ref=cm_cr_getr_d_gw_btm?ie=UTF8,2020-09-28 17:16:20.564923,2020-09-28 17:16:20.832897,"Gildan Mens Ultra Cotton Adult Long Sleeve T-Shirt, 2-Pack T-Shirt",4.3,,Clothing & Accessories,B07683LBDF,No,38
253,AF5GWOSAK3L5CDTJ276KQKRCST3Q,True,Long sleeve shirt,"Awesome quality fir the price! Very impressed, will be ordering more","September 25, 2018",Korrina Turkenburg,5.0,0,https://www.amazon.ca/gp/profile/amzn1.account.AF5GWOSAK3L5CDTJ276KQKRCST3Q/ref=cm_cr_getr_d_gw_btm?ie=UTF8,2020-09-28 17:16:20.838753,2020-09-28 17:16:20.980902,"Gildan Mens Ultra Cotton Adult Long Sleeve T-Shirt, 2-Pack T-Shirt",4.3,,Clothing & Accessories,B07683LBDF,No,38
254,AEJD7TIPFJRTBAE24PBE5HLKX6MQ,True,Great fit!,"Good deal, well made. I will order again and would definitely recommend this product.","August 7, 2019",Bret Clooten,5.0,0,https://www.amazon.ca/gp/profile/amzn1.account.AEJD7TIPFJRTBAE24PBE5HLKX6MQ/ref=cm_cr_getr_d_gw_btm?ie=UTF8,2020-09-28 17:16:20.986758,2020-09-28 17:16:21.150499,"Gildan Mens Ultra Cotton Adult Long Sleeve T-Shirt, 2-Pack T-Shirt",4.3,,Clothing & Accessories,B07683LBDF,No,38
255,AGROJXTWIU4AUVNSBVDODC4S4RMA,True,Bon,Très bien,"December 11, 2019",Serge Blanchet,4.0,0,https://www.amazon.ca/gp/profile/amzn1.account.AGROJXTWIU4AUVNSBVDODC4S4RMA/ref=cm_cr_getr_d_gw_btm?ie=UTF8,2020-09-28 17:16:21.156354,2020-09-28 17:16:21.334168,"Gildan Mens Ultra Cotton Adult Long Sleeve T-Shirt, 2-Pack T-Shirt",4.3,,Clothing & Accessories,B07683LBDF,No,38
256,AEROSXTYJTST3YZ3NKW6HJZPUR3Q,True,These are great!,These are great! Fits as expected,"June 23, 2019",Roxanne meadus,5.0,0,https://www.amazon.ca/gp/profile/amzn1.account.AEROSXTYJTST3YZ3NKW6HJZPUR3Q/ref=cm_cr_getr_d_gw_btm?ie=UTF8,2020-09-28 17:16:21.340096,2020-09-28 17:16:21.492864,"Gildan Mens Ultra Cotton Adult Long Sleeve T-Shirt, 2-Pack T-Shirt",4.3,,Clothing & Accessories,B07683LBDF,No,38
257,AFKOHIF2QHCUKMC26OYSBG67NRDQ,True,its not black more like dark dark blue,"its not black
more like dark dark blue
small was too skin tight
medium was a better feel for me
the small short sleeve t shirt is good but for the long sleeve i prefer the medium","July 28, 2018",Customer,4.0,0,https://www.amazon.ca/gp/profile/amzn1.account.AFKOHIF2QHCUKMC26OYSBG67NRDQ/ref=cm_cr_getr_d_gw_btm?ie=UTF8,2020-09-28 17:16:21.497744,2020-09-28 17:16:21.754739,"Gildan Mens Ultra Cotton Adult Long Sleeve T-Shirt, 2-Pack T-Shirt",4.3,,Clothing & Accessories,B07683LBDF,No,38
